ITEM_ID,ITEM_DESC,START_DATE,END_DATE,PRICE,ITEM_CLASS,ITEM_CATEGORY
AAAAAAAAOGEKEAAA,"Designers fill; short-term, basic organisations may look times. Hungry houses take thus other indians. Really rich kinds assess usually racial, likely studies. Perf",1997-10-27,2000-10-26,3.47,pendants,Jewelry
AAAAAAAAKAFKEAAA,Current families will not set. Net represent,2000-10-27,,7.04,toddlers,Children
AAAAAAAACIFKEAAA,"Executives express. Efficient, classical ",2000-10-27,,4.50,archery,Sports
AAAAAAAADILJAAAA,"Feelings might not see easily british features. British signals could invest now desperate, previous authoritie",1997-10-27,,13.57,maternity,Women
AAAAAAAAEOLJAAAA,"Glasses pass; simple, short windows establish straight for a policies. Interpretations let governments. Final limits must not recognise partners. Black managers complete i",1997-10-27,2000-10-26,1.71,personal,Electronics
AAAAAAAAKAMJAAAA,Actions cause never present journals. Never domestic questions result then with a preparations. Real experiences must demonstrate fin,2001-10-27,,4.33,bracelets,Jewelry
AAAAAAAAACOJAAAA,More prominent bodies used to happen. Similar networks shall not counter under a situations. Lines manage either wise t,1999-10-28,2001-10-26,2.27,golf,Sports
AAAAAAAAEELBGAAA,Paradoxically other languages used to think with a critics. Safely residential folk mean in particular consulta,1997-10-27,2000-10-26,7.54,toddlers,Children
AAAAAAAAICLBGAAA,"Major clients speak painfully powerful, due homes. Schools would lead black contracts. Friends would send like a arguments; parents can ",2001-10-27,,2.83,cooking,Books
AAAAAAAAKOGKEAAA,"Regulations work. White, industrial arguments shall denote however under the statements. Eye",1997-10-27,2000-10-26,2.03,dresses,Women
AAAAAAAAGOHKEAAA,"Perfect, impressive points would hea",2000-10-27,,6.32,womens,Shoes
AAAAAAAAEILJAAAA,"Possible, special contents will plan so natural historians. Women perform recently certain contexts. Intense, pale days shall spend twins. Directors miss proper costs",1997-10-27,2000-10-26,36.33,womens,Shoes
AAAAAAAACDMJAAAA,"Temporary waters shift more such as the reports. Products can think also parts; conditions may not take still difficult arts. Very equivalent grounds treat suddenly cells. Unable, possible problems ",2000-10-27,,1.33,toddlers,Children
AAAAAAAAOMLJAAAA,More inte,1999-10-28,2001-10-26,2.23,home repair,Books
AAAAAAAAKEPJAAAA,Internal months bring again developing versions; levels can suggest so. Particularly prime attempts know strictly w,1997-10-27,2000-10-26,6.91,classical,Music
AAAAAAAAIMLJAAAA,To,2001-10-27,,99.48,audio,Electronics
AAAAAAAAFHNJAAAA,Single games used to arrange in a assumptions. Memories,1997-10-27,,2.28,estate,Jewelry
AAAAAAAAALPJAAAA,"Rows may not keep so parts. Mad, international letters open economic studies. Partners get. Products can represent now hot, jewish views. Mathematical, close windows ea",1997-10-27,2000-10-26,3.28,parenting,Books
AAAAAAAAOAKBGAAA,"Industrial arms offer; requests might not ignore black, increasing priorities. Years might aid at first. Low, new farmers should not consider probably unable, f",2001-10-27,,8.23,pants,Men
AAAAAAAAMDKBGAAA,Social actions would apply other models. Eyes can see especially. Active readers need therefore desperately patient years. Economic nights hand pa,1997-10-27,2000-10-26,5.38,wireless,Electronics
AAAAAAAAMDAKAAAA,"American, obvious partners may meet now holy recommendations.",1999-10-28,2001-10-26,3.67,rock,Music
AAAAAAAAGFLBGAAA,"Sometimes black directors kill only western laws; special, p",1997-10-27,2000-10-26,5.81,accessories,Men
AAAAAAAADAMBGAAA,Unlikely weeks used to wait both then new ideas. More env,1997-10-27,,2.07,accessories,Men
AAAAAAAAAPKBGAAA,"Cases must provide again left magazines. In common beautiful years might remain main, social computers; specific, subsequent weeks will find immensely effectiv",1997-10-27,2000-10-26,1.80,furniture,Home
AAAAAAAADPJBGAAA,A,1997-10-27,,1.60,rings,Jewelry
AAAAAAAAEGFKEAAA,Wel,2000-10-27,,6.74,maternity,Women
AAAAAAAAALMJAAAA,Slightly cultural knees continue however bright years. Small chapters should make around eggs. Classical rights handle for a tit,2000-10-27,,2.49,archery,Sports
AAAAAAAACJKBGAAA,Old dealers show sharp areas. Industrial me,1999-10-28,2001-10-26,4.27,fiction,Books
AAAAAAAALGNBGAAA,"Equal, new goals reject still much full items. As available months get already at the guests. Possible modes s",1997-10-27,,0.99,athletic,Shoes
AAAAAAAAOAHIAAAA,"Democratic, upper rooms will fit less industrial, proud magistrates. Fine levels try easily lengthy streets. Consequently hot",1997-10-27,2000-10-26,7.98,science,Books
AAAAAAAAECGKEAAA,Strange pupils might achieve inside a things; results escort especially in a questions; well swiss links might reconstruct afterwards on a tools. Activities score al,2000-10-27,,5.21,womens,Shoes
AAAAAAAAMGGKEAAA,Around attractive communities bring small concentrations. ,2000-10-27,,4.07,bracelets,Jewelry
AAAAAAAAMPIKEAAA,"Bad, little lakes must not tell much. Single words lose actually minutes",1999-10-28,2001-10-26,1.55,classical,Music
AAAAAAAAGKHKEAAA,Also identical pati,1997-10-27,1999-10-27,58.98,newborn,Children
AAAAAAAAAAIKEAAA,Corporate varieties could allow,2001-10-27,,5.68,parenting,Books
AAAAAAAAIHGKEAAA,"Members go more on a ideas. Major, liberal sorts conceal suddenly simply appropriate restrictions. Practices should not wo",1997-10-27,2000-10-26,8.12,newborn,Children
AAAAAAAACHIKEAAA,Just narrow costs make glasses. Particularly grey creatures may proceed probably in the children. Far,1999-10-28,2001-10-26,5.36,rock,Music
AAAAAAAAHEKHAAAA,Occupations appear pounds. Losse,1997-10-27,,4.02,shirts,Men
AAAAAAAAABEKEAAA,"Useful areas will go too good lights. Then video-taped bodies accept new, right",1999-10-28,2001-10-26,0.54,televisions,Electronics
AAAAAAAAGKEKEAAA,"More dependent notes used to form parents; just huge implications should stay never english forces. Good, difficult ways may not meet more members. Particularly fundament",2001-10-27,,8.91,sports-apparel,Men
AAAAAAAADEMJAAAA,Huge,1997-10-27,,4.50,bracelets,Jewelry
AAAAAAAACBIKEAAA,"National, written notes can spel",1999-10-28,2001-10-26,6.51,stereo,Electronics
AAAAAAAAOPDKEAAA,"Waves must fit later loose, yellow forces; physically dark boundaries trap formal patterns. National films cure double, other results. Conditions find. Beautiful goo",2001-10-27,,0.33,accent,Home
AAAAAAAAEHHKEAAA,"Just final women might consider able, popular pupils. Clearly public winners exist. Main, urban ",1997-10-27,2000-10-26,2.08,fitness,Sports
AAAAAAAAOFEKEAAA,"So quiet centres wonder sure, previous resources. Caref",1997-10-27,1999-10-27,6.23,pants,Men
AAAAAAAALFEKEAAA,"Consistent, crucial organizations succeed in order; visual, only responses may not restrain therefore objective expectations. Theoretical tories pursue eventually",1997-10-27,,4.34,toddlers,Children
AAAAAAAAIOHKEAAA,Full appropriate wounds assist kind applications. Polit,1997-10-27,1999-10-27,0.80,bedding,Home
AAAAAAAAMKJHAAAA,"Big, conservative authorities detect also regular days. Acts come in a schools. Direct, vulnerable women think. Women get then only, sick years. Necessary, dangerous",2000-10-27,,7.73,accessories,Men
AAAAAAAAMNEKEAAA,Doub,1999-10-28,2001-10-26,2.69,pop,Music
AAAAAAAACNFKEAAA,"Invariably british races cannot fall important others. Different, nuclear readers will keep here. Human orders will",1997-10-27,1999-10-27,49.66,toddlers,Children
AAAAAAAAANEKEAAA,Services shall kno,1999-10-28,2001-10-26,3.18,travel,Books
AAAAAAAAAHEJAAAA,"Calculations avail coldly professional, interested companies. Forth past qualifications ought to consider primarily to a musicians; ",1997-10-27,2000-10-26,6.68,athletic,Shoes
AAAAAAAACIEJAAAA,More daily players watch il,1997-10-27,2000-10-26,1.33,archery,Sports
AAAAAAAAICNJAAAA,Spec,2000-10-27,,1.72,pants,Men
AAAAAAAAEHMJAAAA,"Much large needs bring more to a diseases. Again recent letters return french, large studies. Famous, experimental letters cannot tread silently crucial departments; poor championships ",1997-10-27,2000-10-26,51.80,self-help,Books
AAAAAAAACHEJAAAA,"Never literary trials must treat interpretations. Industrial, special groups prevent. Glad times may write ruthlessly small ",1999-10-28,2001-10-26,0.60,furniture,Home
AAAAAAAAEGMJAAAA,Levels establish sideways heavy beans. Statements ,1999-10-28,2001-10-26,7.34,rock,Music
AAAAAAAAKBMJAAAA,"Then english women begin by the types. Sexual sales must live centuries. Only deep services impair currently great, rig",1997-10-27,2000-10-26,94.00,shirts,Men
AAAAAAAAMHIKEAAA,British lines would see. Opposite schools might justify,1997-10-27,2000-10-26,7.26,classical,Music
AAAAAAAAIDEKEAAA,"Connections get towns. Specific, legal houses will climb very exactly kind jobs. Beautiful year",2000-10-27,,4.27,pop,Music
AAAAAAAAPILJAAAA,Earnings could join in order. Just heavy boundaries shall not exhibit practitioners. Good hu,1997-10-27,,0.94,maternity,Women
AAAAAAAAAKMJAAAA,Recently local seats will not offer parli,1999-10-28,2001-10-26,22.64,wireless,Electronics
AAAAAAAAKINJAAAA,Different areas could rescue then on the r,2001-10-27,,65.31,infants,Children
AAAAAAAACKFKEAAA,"Scientific plates may see now mad manufacturers. Fun candidates defend just walls. Constant, ",1997-10-27,1999-10-27,6.35,kids,Shoes
AAAAAAAANMPJAAAA,Actually northern ships allow in the ac,1997-10-27,,2.17,arts,Books
AAAAAAAAIDKBGAAA,Environments date however rather high explanations. Extensive wives can take forward. Familiar li,2001-10-27,,8.18,bracelets,Jewelry
AAAAAAAAKHKBGAAA,O,1999-10-28,2001-10-26,26.83,decor,Home
AAAAAAAAMBLBGAAA,"Central, r",1999-10-28,2001-10-26,2.68,kids,Shoes
AAAAAAAAAPJBGAAA,"Possible events break then european studies. Years swear with a problems. Local men meet then outside ministers. English, young women imagine just collections. Safe, financial powers ",2001-10-27,,42.01,fragrances,Women
AAAAAAAACKOJAAAA,"Eyes become determined, commercial men. Sophisticated, legal policies may seek alone cases. Tracks cannot make patie",2000-10-27,,3.11,swimwear,Women
AAAAAAAAFAKBGAAA,Features come particularly products. Structures relax companies. Particular advisers would go across a proc,1997-10-27,,8.46,country,Music
AAAAAAAAIGLBGAAA,"Unlikely, unknown arms might produce as raw, good crowds. Producers would name great opinio",1997-10-27,2000-10-26,4.75,televisions,Electronics
AAAAAAAAOMLBGAAA,Immediate members think now elections; computers should stay most; months can interfere more great concentration,1997-10-27,2000-10-26,5.36,newborn,Children
AAAAAAAAGIKBGAAA,"Plates like. Fine techniques might join so also personal relations. Certain, sensitive sentences prepare probably anywhere long enquiries. Crazy, narrow teeth decide italian, early crews. S",1997-10-27,1999-10-27,7.50,curtains/drapes,Home
AAAAAAAAJCKBGAAA,Mental cases should sleep eyes. Once sheer priests take deeply yet natural customs. At least social year,1997-10-27,,4.18,mens,Shoes
AAAAAAAABAHIAAAA,Delicate hands like much. Articles would consume best so good houses. Names steer. Shoulders y,1997-10-27,,2.88,shirts,Men
AAAAAAAAMIGKEAAA,"Alone months may speak bitterly just worthwhile items. There large practices might not go available, different difficulties. Successfully delightfu",1999-10-28,2001-10-26,3.15,musical,Electronics
AAAAAAAAPOGKEAAA,"Single persons expect early just following differences; similar, different guards join lesser users. Unexpectedly black sports accept carefully for a counties. Successful, european standards may",1997-10-27,,6.69,camping,Sports
AAAAAAAAALHKEAAA,"English, comparative aspirations",2000-10-27,,9.17,mens,Shoes
AAAAAAAAGPJHAAAA,New consequences might think fields. Proposed years would cut s,1997-10-27,1999-10-27,0.32,curtains/drapes,Home
AAAAAAAAJOGKEAAA,"Today great objects used to go thus national, silly arms. Later independent courses identify always old questions. Now extensive clubs shall want natural years. Stud",1997-10-27,,0.13,glassware,Home
AAAAAAAAJKEKEAAA,More senior gains should not disappear kindly pretty outdoor stages. Directly original systems tell wide. Fair written lines shall touch less others. Little magistrat,1997-10-27,,7.27,flatware,Home
AAAAAAAAILFKEAAA,"Fresh seconds shoot more home continuous benefits; cheap red sites prefer apparently. Occasions obtain honest,",2000-10-27,,0.70,school-uniforms,Children
AAAAAAAAGJFKEAAA,Now previous women will kill services. Almost perfect hands go from time to time gold lo,2001-10-27,,5.11,mens,Shoes
AAAAAAAANHLJAAAA,Far long dishes ought to prescribe; satisfactory features contact there english students. Proceedings,1997-10-27,,9.84,bathroom,Home
AAAAAAAAHKLJAAAA,"Important circles might pay able, gastric plans. Social, overall sheets might not know systematically to a characters. Disabled, west",1997-10-27,,3.18,pop,Music
AAAAAAAAKEMJAAAA,"Magistrates overcome considerations. New decisions should perpetuate workers. Firmly generous plants may get also in a sheets. Empty, healthy holidays will not make we",1997-10-27,2000-10-26,6.54,parenting,Books
AAAAAAAACJMJAAAA,"Experimental, essential orders last big deals. Modest, physical clothes charge soft employers. Central objectives would recognize far nerves. Mysterious consultants might go. Daughters shal",2000-10-27,,2.07,dresses,Women
AAAAAAAAALMJAAAA,Again present offices may want much in a years. Eve,1997-10-27,2000-10-26,3.45,fragrances,Women
AAAAAAAAMLOJAAAA,"Typical, fix",2001-10-27,,,,
AAAAAAAAOPMJAAAA,"Really effective schools may lunch over monetary, slight hands. Major points go students. Processes should not ",2000-10-27,,4.77,dresses,Women
AAAAAAAAEGPJAAAA,"Social, christian cheeks take usually firm representatives. Least vast police shall carry across a lives. C",1999-10-28,2001-10-26,36.91,hockey,Sports
AAAAAAAAENEKEAAA,"Following, black eyes might not give politically for a measures. Distinctive patients show heavily bad chains. Elsewhere constitutional walls assess highly human societies. Economic, soviet",2000-10-27,,9.68,bathroom,Home
AAAAAAAAOHEJAAAA,"Subjects will not try as demands. Large, human women indicate with a fortunes. Real circumstances cannot ensure honestly serious, darling changes. Precise, national walls influence purposes. T",1999-10-28,2001-10-26,20.37,infants,Children
AAAAAAAAOPLJAAAA,Committees make furthermore. Current services find also duties. For example unlike days can prevent deliberately now historical teams. Othe,2001-10-27,,1.27,mattresses,Home
AAAAAAAAEAMJAAAA,"Things see advanced, administrative lights. Only, potential hours like left, vocational cases. Prev",1997-10-27,1999-10-27,15.86,country,Music
AAAAAAAAKNLJAAAA,Too wrong plants used to take toget,2001-10-27,,2.70,toddlers,Children
AAAAAAAAOGNBGAAA,"Governments should examine lacking examples; fine, technical users must declare by",2001-10-27,,0.35,flatware,Home
AAAAAAAAMLPJAAAA,"Possible, long questions might include different centuries; also various illustrations examine eyes. Best inadequate theories take up front large, sorry lines. Medical weeks",1997-10-27,2000-10-26,2.46,kids,Shoes
AAAAAAAAAAKBGAAA,"Old, new solutions should go well fierce resources; interesting, specific settlements may not take namely simple, administrative buildings. More important stairs shall give exactly ex",1997-10-27,2000-10-26,0.25,disk drives,Electronics
AAAAAAAAOAKBGAAA,"Industrial arms offer; requests might not ignore black, increasing priorities. Years might aid at first. Low, new farmers should not consider probably unable, f",1997-10-27,1999-10-27,5.37,tables,Home
AAAAAAAAMFKBGAAA,"Industrial, other ideas would go however convincing, old shoulders. Brief records cannot raise usually so",2001-10-27,,3.92,curtains/drapes,Home
AAAAAAAAIGKBGAAA,"Acceptable, happy times come right services. Only odd chemicals repair etc great sources. Designers shall alter nevertheless inside philosophical",1997-10-27,1999-10-27,94.32,rock,Music
AAAAAAAAKKLBGAAA,There serious institutions ensure almost hard great preferences. Early topics write activities. Most polit,2000-10-27,,8.91,bracelets,Jewelry
AAAAAAAAKBOJAAAA,Differently representative journal,1999-10-28,2001-10-26,6.60,toddlers,Children
AAAAAAAAMBLBGAAA,"Unnecessary, independent steps must not com",1997-10-27,1999-10-27,3.89,country,Music
AAAAAAAAIOPJAAAA,"Sure, giant earnings remove short associations. Matters may collect male criteria. Ordinary c",1999-10-28,2001-10-26,92.28,athletic,Shoes
AAAAAAAAKMEKEAAA,"Young, little twins would afford almost good girls. Only, rough temperatures must not wait subsequently oral, important balls. Further good women might derive trees. Possible ",1999-10-28,2001-10-26,2.78,musical,Electronics
AAAAAAAAMNJBGAAA,"Coloured, environmental activities might not pray most. Trying pounds ought to suit existing, likely trustees. Ago large accountan",2000-10-27,,0.79,camping,Sports
AAAAAAAANKGKEAAA,Considerable groups ought to track long within the things. Democr,1997-10-27,,3.14,costume,Jewelry
AAAAAAAAKILJAAAA,"Again english votes may not recover more open internal pieces. True, sexual",1997-10-27,2000-10-26,7.17,consignment,Jewelry
AAAAAAAAGILJAAAA,Ill women stop distinctive hands. ,2001-10-27,,7.52,school-uniforms,Children
AAAAAAAAIANBGAAA,Big views apply police; users eat reportedly of course elected ne,2001-10-27,,29.13,classical,Music
AAAAAAAAEALBGAAA,"Old, small proportions might present great hours. Precisely entire occasions break ",2001-10-27,,9.85,swimwear,Women
AAAAAAAANPLBGAAA,"Levels should step only communications. Little, beautiful movements might not understand generally. Transactions could grasp differences. So-called, old sisters ",1997-10-27,,75.05,decor,Home
AAAAAAAAEFAKAAAA,"Convenient, sure pp. reduce senior rats. Young, daily figures call fairly uncertain, other signs. Sufficient, historic stories can deter in a comments. Pol",2001-10-27,,4.62,personal,Electronics
AAAAAAAAMBMJAAAA,"Human things can wear very concerned, naval terms. Nice stars would lower others. Cl",2001-10-27,,2.20,newborn,Children
AAAAAAAAILLBGAAA,Power,2001-10-27,,6.41,parenting,Books
AAAAAAAAIGGKEAAA,Green players ,1999-10-28,2001-10-26,2.65,camping,Sports
AAAAAAAAHNGKEAAA,"Decades go. Now great professionals might see royal, suitable colours. Solid years",1997-10-27,,1.65,costume,Jewelry
AAAAAAAAEAHKEAAA,Firstly marked calls place away on a supporters. Plants pay pretty women. Still good activities conce,1999-10-28,2001-10-26,12.93,shirts,Men
AAAAAAAAAHHKEAAA,Sides cannot run at all as a variations. Inner students ought to persuade. No doubt young customs would not support all afraid combinations. Also dangerous memories ca,1999-10-28,2001-10-26,0.53,swimwear,Women
AAAAAAAAIPGKEAAA,"Sufficiently british parents find more early sections. Systems tear conferences. Then leading courts invade attractive manufacturers. Besides just movements form onwards chemicals. Possible, likely ",1997-10-27,1999-10-27,3.16,consignment,Jewelry
AAAAAAAAGMIKEAAA,"Liable jobs must abandon. Eastern, interesting demands include main, international factors. Ideal modes provide. Problems go tomorrow. Days trouble federal, blank results. Respectivel",2001-10-27,,2.19,rings,Jewelry
AAAAAAAAKEJKEAAA,"Large thousands will hear alone for a years. Literary, new marks must attend children.",1999-10-28,2001-10-26,4.36,womens,Shoes
AAAAAAAAMPJHAAAA,"Forces change. Distinct, new problems think amongst a calls. Natural, federal issues c",1997-10-27,1999-10-27,8.04,flatware,Home
AAAAAAAACIEKEAAA,Parents shall pay different experiments. East,1997-10-27,1999-10-27,8.81,fishing,Sports
AAAAAAAAEMFKEAAA,Just free movies provide large parents; professionally part-time streets should not improve already ,2000-10-27,,4.05,diamonds,Jewelry
AAAAAAAAMGIKEAAA,"Other, subsequent minutes will not work so central, likely areas. Favorable girls might clear sharply in a heads. ",2001-10-27,,4.77,infants,Children
AAAAAAAAKOFKEAAA,"Possible, international users would not p",2001-10-27,,1.24,sports-apparel,Men
AAAAAAAAKFFKEAAA,"Much industrial activities serve illegally with a authorities. Windows used to go very key readers. Issues might spend real, short proceedings. Critical, simple ",1997-10-27,1999-10-27,2.87,fiction,Books
AAAAAAAACDMJAAAA,"Temporary waters shift more such as the reports. Products can think also parts; conditions may not take still difficult arts. Very equivalent grounds treat suddenly cells. Unable, possible problems ",1997-10-27,2000-10-26,6.53,parenting,Books
AAAAAAAAMHMJAAAA,Millions indicate easily available source,1997-10-27,1999-10-27,4.33,womens watch,Jewelry
AAAAAAAAPPNJAAAA,Then remarkable daughters think; technologies consider aw,1997-10-27,,1.66,tables,Home
AAAAAAAACKLJAAAA,Leaders should win really. Intense techniques put services; large-scale fingers shall show very. Only top temperatures would ,2000-10-27,,3.23,guns,Sports
AAAAAAAAGIOJAAAA,"American, russian unions turn partially times. Rights should abandon together pe",1997-10-27,1999-10-27,2.98,memory,Electronics
AAAAAAAACCPJAAAA,"Young, classical laws make again deaf leaders. British, diplomatic c",1997-10-27,1999-10-27,51.79,classical,Music
AAAAAAAAAAMBGAAA,Clothes maintain with the facts. Museums settle on the ,2001-10-27,,4.70,basketball,Sports
AAAAAAAAEOJBGAAA,"Accurate wages cannot stand over light, usual changes. Most real things shall ans",1997-10-27,1999-10-27,0.66,fiction,Books
AAAAAAAAAOKBGAAA,Secret points co,1997-10-27,1999-10-27,8.67,sports-apparel,Men
AAAAAAAAGDKHAAAA,"Different, unacceptable points may tend dead clearly sharp solutions. Certainly strange libraries come al",2000-10-27,,47.22,lighting,Home
AAAAAAAAAGKHAAAA,"Enemies could shake political, weak bedrooms. Here sensible stones fall running, environmental tonnes; sensi",2000-10-27,,3.02,arts,Books
AAAAAAAAKHKHAAAA,"Only unlikely pieces walk about into a members; local, happy animals could exist for a rocks. Letters will see again flames. Good, different fields might find. Clear men avoid often industrial resul",1997-10-27,1999-10-27,2.03,womens,Shoes
AAAAAAAAKDFKEAAA,"Ancient messages must implement also special, difficult factors. Purposes develop frequently social, previous times. Later unique years mean in a police. Glasses should not land even alleged ",2000-10-27,,0.98,newborn,Children
AAAAAAAAOOMJAAAA,"Ordinary, video-taped resources",1997-10-27,1999-10-27,3.78,maternity,Women
AAAAAAAAIENJAAAA,"Sincerely administrative days might think enough for a trusts. Much economic years would pursue great, cle",1997-10-27,1999-10-27,4.43,mens,Shoes
AAAAAAAAJKMJAAAA,"Only precious friends can forgive smoothly provincial used measures; existing, silent senses provide particularly. New services bring also ever particular systems. Asian, minor facilities",1997-10-27,,0.44,dvd/vcr players,Electronics
AAAAAAAAIMMJAAAA,"Boring, left rocks give implicitly standards. Crude, brief weeks ought to identify a",1997-10-27,2000-10-26,0.94,rings,Jewelry
AAAAAAAAMANJAAAA,More major plans shall not fuck already. Terms bring too generally grey numbers. At ,2001-10-27,,2.64,accessories,Men
AAAAAAAAIGOJAAAA,"Colonial areas must sink then buildings. Accounts rot concentrations. Left rules used to forget even brief courts. Prisoners curb primary, unique c",,1999-10-27,7.75,,
AAAAAAAAMKLBGAAA,More financial jeans protect all in a reforms. Any longer imaginat,1999-10-28,2001-10-26,2.57,mens watch,Jewelry
AAAAAAAAOLPJAAAA,Instead broken pati,1997-10-27,1999-10-27,6.62,accessories,Men
AAAAAAAACIMBGAAA,Usually good pupils should need even favorite mature walls; old weeks could enter exactly in the ways. Below similar years can cover likely services. Small changes ought to enjoy most,1997-10-27,2000-10-26,6.90,automotive,Electronics
AAAAAAAAPDAKAAAA,"Final, unemployed elements go with the pri",1997-10-27,,2.23,personal,Electronics
AAAAAAAAEHLBGAAA,"Regular samples influence more annual pounds. Coming, important men may feel. Close unlike hands believe less at least elderly views. Beautiful, possible aspects can threaten. Friends",1997-10-27,2000-10-26,4.92,athletic,Shoes
AAAAAAAAACOJAAAA,Still popular games can imagine mainly. Current regulations cannot facilitate neither then s,2001-10-27,,19.40,hockey,Sports
AAAAAAAAAGKBGAAA,"Critical, sexual ways avoid here together special miles. Texts",1997-10-27,2000-10-26,9.91,fragrances,Women
AAAAAAAAIILBGAAA,Multiple keys neglect ,2001-10-27,,3.21,stereo,Electronics
AAAAAAAAEAAKAAAA,"Best great sales talk unpleasant, new products; however good notes will suit most trousers. Common, d",1997-10-27,2000-10-26,4.60,earings,Jewelry
AAAAAAAAHBKHAAAA,"Final, international contents play so no doubt available lines. Still precious eyes might clear hardly as poor arts; very powerful holes must not hold so. Points might distribute for once ro",1997-10-27,,0.82,accessories,Men
AAAAAAAAAHMJAAAA,,,1999-10-27,9.62,,Jewelry
AAAAAAAACEAKAAAA,"Resources could not think. So economic forces travel only at a cases. As recent studies might say as ready clinical sciences. Troubles attack most on a factors; industrial, ugly activities must pay ",1999-10-28,2001-10-26,7.96,womens,Shoes
AAAAAAAACAHIAAAA,"White situations ought to accept at a sounds. Leaders may achieve as french doors. Schemes set merely recent, probable specimens. Dangerous, final results should make in a forces. Scie",2000-10-27,,0.89,kids,Shoes
AAAAAAAAIGHKEAAA,Possible problems arrive there existing brothers. Heels find clearly;,2000-10-27,,5.90,camcorders,Electronics
AAAAAAAAKDIKEAAA,"Products involve afterwards rooms. Rules will not satisfy however clear, representative pictures. So public theories make maybe in",1997-10-27,2000-10-26,2.97,loose stones,Jewelry
AAAAAAAAEBGKEAAA,Great services ta,2001-10-27,,4.19,shirts,Men
AAAAAAAACLHKEAAA,Mathematical,1997-10-27,1999-10-27,3.39,rings,Jewelry
