ITEM_ID,ITEM_DESC,START_DATE,END_DATE,PRICE,ITEM_CLASS,ITEM_CATEGORY
AAAAAAAACPEKEAAA,"Flexible, black accidents could not worry therefore today soft programs. Pains could not study so then narrow walls. Brave visitors might move of course. Of course new members give about by a months",1997-10-27,2000-10-26,3.54,gold,Jewelry
AAAAAAAAKHLJAAAA,White opponents must not come over for a houses. Women might not mean hours; thus national autho,1999-10-28,2001-10-26,0.35,classical,Music
AAAAAAAAEKLJAAAA,Banks would act so parliamentary categories. Young years ,1999-10-28,2001-10-26,9.84,memory,Electronics
AAAAAAAAACMJAAAA,"Orange, overall poli",2000-10-27,,4.02,athletic shoes,Sports
AAAAAAAAEMNJAAAA,Daughters might lead available systems. Static terms might find secondly social cases. Strongly waste years would eat only in the views; extra eyes will not lead somewhere ,1997-10-27,2000-10-26,0.66,wallpaper,Home
AAAAAAAAEMMJAAAA,"Good proceedings shall clear. Special, new evenings ought to see high visitors. Proceedings express; therefo",1999-10-28,2001-10-26,4.90,loose stones,Jewelry
AAAAAAAAEPMBGAAA,Factors s,2000-10-27,,5.44,country,Music
AAAAAAAAKOKBGAAA,"Perfect, initial perceptions challenge. Forward high times cannot load just. Alone full services should test outside, bottom stations. Beautiful, unnecessary shops woul",1997-10-27,2000-10-26,9.70,consignment,Jewelry
AAAAAAAAHDLBGAAA,"Almost cold measures live splendid, related elements. Strictly final terms would not fall really materials. Young organizatio",1997-10-27,,1.97,toddlers,Children
AAAAAAAAPAAKAAAA,"Now different companies go actual, different",1997-10-27,,37.95,entertainments,Books
AAAAAAAAMDAKAAAA,Very relevant hands proceed at least chips. Sophisticated settings reduce; lar,2001-10-27,,3.81,scanners,Electronics
AAAAAAAACNKBGAAA,Standa,2000-10-27,,5.69,swimwear,Women
AAAAAAAAOFEKEAAA,"Clear, other eyes look problems. ",2001-10-27,,5.20,athletic,Shoes
AAAAAAAAGKFKEAAA,Later mild purposes must not see only on a proposals. More than new patients land dark libraries. Chemica,1997-10-27,2000-10-26,0.70,maternity,Women
AAAAAAAAGKFKEAAA,Later mild purposes must not see only on a proposals. More than new patients land dark libraries. Chemica,2000-10-27,,8.63,blinds/shades,Home
AAAAAAAALHFKEAAA,"Children must influence as male, small schools. Boxes would save less practical, growing officia",1997-10-27,,3.11,maternity,Women
AAAAAAAAMLMJAAAA,"Attractive styles cannot move. Open, likely feelings may conclude within the officers. Far particular animals should run in a organisers. Facilities",1997-10-27,2000-10-26,7.87,cooking,Books
AAAAAAAAGNMJAAAA,"Machines will not meet old periods. Right, healthy deputies contract. Most coherent terms s",2001-10-27,,9.03,kids,Home
AAAAAAAAIFNJAAAA,"Good hands come appropriate, dead terms; different police formulate gaps. Ready economies should const",1997-10-27,2000-10-26,4.86,science,Books
AAAAAAAAKNMJAAAA,Entire rivers show voluntary questions. Full eyes used to help merely,1997-10-27,2000-10-26,6.08,history,Books
AAAAAAAANGPJAAAA,Machines will ha,1997-10-27,,4.17,decor,Home
AAAAAAAAMLNBGAAA,"Small, private pupils fill sooner with a pp.. Likely, cath",2001-10-27,,4.52,country,Music
AAAAAAAAIPNBGAAA,Advisers could agree then off a material,1997-10-27,1999-10-27,7.51,portable,Electronics
AAAAAAAAMPJBGAAA,Socially old universities will hold independently restrictions; basic years may not get full other illustrations. Fully other sto,2001-10-27,,0.09,mens,Shoes
AAAAAAAAKCKBGAAA,Universities fail just good pieces. Materials attract good practitioners. Different levels eat before a concerns. Outside young ministers inform about,2000-10-27,,0.32,pants,Men
AAAAAAAANHKBGAAA,"Frequently happy strings arise possible shares. Additional, assistant opportunities may not improve different courses. Competitive victims would not kill whole, new parties. Students will live ",1997-10-27,,4.98,school-uniforms,Children
AAAAAAAAICLBGAAA,Al,1997-10-27,1999-10-27,37.13,curtains/drapes,Home
AAAAAAAALEAKAAAA,"Most specific gifts open similar, pink nights. Recent students ignore both; secondary, mean minutes will not achieve. Barely common procedures would require both over subsequent solicitor",1997-10-27,,8.03,musical,Electronics
AAAAAAAAGFKBGAAA,"Economic mistakes control new years. Young, new eyes buy just universal differences. All but popular shares must go at least wealthy, urban sales. Ethnic, parliam",1999-10-28,2001-10-26,3.29,rock,Music
AAAAAAAAOGKBGAAA,"Small results tell close countries; universal, young concerns leave also scientific clothes. Most available",1999-10-28,2001-10-26,2.98,diamonds,Jewelry
AAAAAAAAIJLBGAAA,Everyday crews must not leave yesterday fully national shares. Still likely users wou,1997-10-27,2000-10-26,2.47,sports-apparel,Men
AAAAAAAAMLLBGAAA,Forces look activities. Days shall give just forces. Holy instructions could ,2000-10-27,,0.27,kids,Home
AAAAAAAAMBMBGAAA,Necessary films know soon. Too o,1997-10-27,2000-10-26,7.94,wireless,Electronics
AAAAAAAADHMJAAAA,"Characters ought to ignore british, other provisions. Relations could not increase standard costs. Long other years might not buy nuclear sales. Other types buy a",1997-10-27,,8.99,loose stones,Jewelry
AAAAAAAADFOJAAAA,"Possible police would go somewhere due, comparative surfaces. Details work long valuable falls. Christians raise. Beautiful, ",1997-10-27,,7.76,maternity,Women
AAAAAAAAANLBGAAA,"Immediate, litera",2001-10-27,,1.41,tables,Home
AAAAAAAAANMBGAAA,"Full, appropriate goods may say indeed hopefully effective troubles. Economic sales could not think. Stories measure accordingly from the specialists; similar, red eyes may use inevitably ",2000-10-27,,8.85,athletic shoes,Sports
AAAAAAAAACGKEAAA,Deliberately constitutional years lead as up a concerns. Whole holders excee,1997-10-27,1999-10-27,0.65,bedding,Home
AAAAAAAAEJHKEAAA,"Other, desperate services will not drink. Incredible elements investigate. Bab",1997-10-27,1999-10-27,1.52,gold,Jewelry
AAAAAAAAELIKEAAA,"Other, important women find a bit longer particular needs. Successful officers might win richly easy per",1999-10-28,2001-10-26,1.54,dvd/vcr players,Electronics
AAAAAAAADLGKEAAA,Respondents join local profits; only green children must say of course.,1997-10-27,,3.84,arts,Books
AAAAAAAAFBFKEAAA,Important effects should not confi,1997-10-27,,0.88,fitness,Sports
AAAAAAAACDKHAAAA,"Specified, british wishes mean eventually gradual systems. Deeply entire books might raise. Beautiful, hard materials miss institutions; little, new ears come northern ",1997-10-27,1999-10-27,2.94,rock,Music
AAAAAAAAPMJHAAAA,Changes ,1997-10-27,,1.28,classical,Music
AAAAAAAAEIIKEAAA,"Changes ought to help successful, fine industries; far easy others used to find comple",1997-10-27,1999-10-27,6.16,pants,Men
AAAAAAAABMHKEAAA,"Times deal good natural values. Clear, big prisoners ought to bear to a parents",1997-10-27,,8.95,travel,Books
AAAAAAAAMBEKEAAA,Procedures contai,1999-10-28,2001-10-26,1.98,classical,Music
AAAAAAAAEAEKEAAA,"Open, necessary lips should rest brief, long-term premises. Grounds would come just cells. Voluntary directors may emp",1997-10-27,1999-10-27,9.98,bracelets,Jewelry
AAAAAAAAEHEKEAAA,"Central, other la",1997-10-27,2000-10-26,3.01,infants,Children
AAAAAAAAKOFKEAAA,"Possible, international users would not p",1999-10-28,2001-10-26,0.85,golf,Sports
AAAAAAAAELLJAAAA,Perhaps economic companies would tell groups; ways secure maps; essentially high lo,1997-10-27,2000-10-26,2.87,athletic,Shoes
AAAAAAAACGOJAAAA,Now progressive materials may not use too important cheeks.,1999-10-28,2001-10-26,1.89,flatware,Home
AAAAAAAAMHNJAAAA,"Very, male approaches may not start somehow categories. Tropical changes use as wide, deep years. Often bad discussions must not intro",1997-10-27,2000-10-26,4.77,newborn,Children
AAAAAAAAEDMBGAAA,About proper parts improve to a arguments; types shall live absolutely. Of course sign,2000-10-27,,3.78,decor,Home
AAAAAAAAIDNBGAAA,Police shall put more. Very serious daughters will say also in a courses. Complete sports ,2001-10-27,,2.90,camcorders,Electronics
AAAAAAAACHNBGAAA,"Right, grey boys accept children.",2000-10-27,,3.62,infants,Children
AAAAAAAAAIKBGAAA,Only detailed events will live. Troops must not change today more differ,1999-10-28,2001-10-26,7.31,classical,Music
AAAAAAAAJPAKAAAA,Old ministers used t,1997-10-27,,7.38,earings,Jewelry
AAAAAAAAOOLBGAAA,Rather continued p,1997-10-27,1999-10-27,8.54,costume,Jewelry
AAAAAAAABJHKEAAA,"Very jewish fans meet still good, old lines. Tonnes would inform temporarily only in",1997-10-27,,3.55,karoke,Electronics
AAAAAAAAEAEKEAAA,Primitive cases may not see,1999-10-28,2001-10-26,2.27,musical,Electronics
AAAAAAAAOPLJAAAA,"Occasions say legs. Only, free finge",1997-10-27,1999-10-27,0.24,custom,Jewelry
AAAAAAAAECNJAAAA,Surprised spaces help. Essential families breed now normal schools. Lucky shares might not remember above generall,2001-10-27,,2.84,sports-apparel,Men
AAAAAAAAKDNJAAAA,"Vast, important activities ask more technical, excellent s",1997-10-27,2000-10-26,3.41,mens watch,Jewelry
AAAAAAAADIOJAAAA,"Perhaps contemporary steps must move thus interesting blocks. Odd experts control incidents. Thanks pass indeed single photographs. Ever strange parts ask healthy, litt",1997-10-27,,84.35,pop,Music
AAAAAAAAFBNJAAAA,More great representations take betw,1997-10-27,,7.74,automotive,Electronics
AAAAAAAAPIOJAAAA,"Questions promote in a eyes. Annual, solid railways could make never wise parties. Black, monetary ",1997-10-27,,4.52,womens,Shoes
AAAAAAAAEJNJAAAA,"Direct, whole pictures take at the photographs. Students become problems. Green paintings ",1997-10-27,2000-10-26,3.65,rings,Jewelry
AAAAAAAAMNMBGAAA,"Hands write british, extraordinary publishers; current workers might ",2000-10-27,,4.61,classical,Music
AAAAAAAAENNBGAAA,W,2001-10-27,,6.65,home repair,Books
AAAAAAAAMMNJAAAA,"At least firm commitments may give finally full, open sales; closely complete publications tour too eyes. Limited, initial elements will w",1997-10-27,1999-10-27,9.39,earings,Jewelry
AAAAAAAAIANBGAAA,"Only, local laws fall. Subjects might not get fields. Little difficulties shall not emphasize effective titles",1999-10-28,2001-10-26,7.69,shirts,Men
AAAAAAAAAMJBGAAA,"Surprised teams go. Mental, forward services would come eventually; in add",1999-10-28,2001-10-26,8.53,televisions,Electronics
AAAAAAAAMLPJAAAA,"Small systems identify local, young spots. Charts ought to know reasonable m",2000-10-27,,0.68,dvd/vcr players,Electronics
AAAAAAAAJPJBGAAA,"Heavy, short descriptions tread also well confident years. Buildings may not identify. Police",1997-10-27,,0.72,reference,Books
AAAAAAAAHCMBGAAA,"Efficiently social types say; competitive, dark schemes cannot get lost, random glasses. Working bishops fit all right so united markets. Pr",1997-10-27,,6.54,pants,Men
AAAAAAAACCMJAAAA,"Easily efficient bonds trust female, angry ce",1999-10-28,2001-10-26,4.78,consignment,Jewelry
AAAAAAAACAOJAAAA,"Other, hot pages learn significant, novel passengers. Still important profits open here other versions. Regional, temporary cards could tell; useless,",1997-10-27,1999-10-27,18.30,swimwear,Women
AAAAAAAAMLEKEAAA,"Significant homes come ago old weapons. Yet high levels come ministers. As usual stages should not rise in order whole, certain pieces. Moreover high games mean single women. So",1997-10-27,2000-10-26,0.22,memory,Electronics
AAAAAAAAOANBGAAA,Individ,2001-10-27,,9.03,athletic,Shoes
AAAAAAAAAPGKEAAA,Patte,1997-10-27,2000-10-26,3.18,womens,Shoes
AAAAAAAAAPGKEAAA,"Low, heavy hopes would feel actually. Secret grounds agree also healthy symptoms. Here organic states may not seem between a settings. Thoughts will purchase still",2000-10-27,,5.53,maternity,Women
AAAAAAAAKDIKEAAA,"Products involve afterwards rooms. Rules will not satisfy however clear, representative pictures. So public theories make maybe in",2000-10-27,,4.03,pools,Sports
AAAAAAAAJCGKEAAA,"Techniques must leave brown laws. Companies ought to serve more fat times; police describe well previous galleries. Institutions prevail desperate, immediate roles. Possibl",1997-10-27,,9.73,womens,Shoes
AAAAAAAAIBFKEAAA,Provincial fingers matter bitter students; now voluntary pictures climb even. There front p,1999-10-28,2001-10-26,1.89,sports-apparel,Men
AAAAAAAAIKJHAAAA,"Changes should give here separate, particular windows. Facts leave perfectly sales. Capable, final negotiations shou",1997-10-27,1999-10-27,1.17,romance,Books
AAAAAAAAGPJHAAAA,New consequences might think fields. Proposed years would cut s,1999-10-28,2001-10-26,9.88,earings,Jewelry
AAAAAAAAODKHAAAA,Ac,1997-10-27,1999-10-27,0.40,cameras,Electronics
AAAAAAAAMFEKEAAA,"Ambitions could cause safely; in between new sources cannot abolish surprisingly on a problems. Used workers go now correct, dead months. Final, unable attitudes can push mos",2000-10-27,,4.49,blinds/shades,Home
AAAAAAAAIPDKEAAA,Political roses will rewrite els,1999-10-28,2001-10-26,8.24,pop,Music
AAAAAAAAMLOJAAAA,"Typical, fix",1999-10-28,2001-10-26,3.80,school-uniforms,Children
AAAAAAAAEFNJAAAA,"Teeth ought to send undoubtedly planes. Important, final proportions should not contact writers. Christian, famous guests allow already things; great photographs ma",1999-10-28,2001-10-26,2.65,classical,Music
AAAAAAAAOGOJAAAA,Soci,2001-10-27,,9.67,disk drives,Electronics
AAAAAAAAGLOJAAAA,"For example economic bits should play too written, national places. Consistently usual improvements ring above once old words. Ever other feet share invariably positive, min",1999-10-28,2001-10-26,94.48,lighting,Home
AAAAAAAADPNJAAAA,Now human ,1997-10-27,,1.79,athletic,Shoes
AAAAAAAAAEPJAAAA,"Local, different customers seek again never big items. Interesting, available groups want. Companies seek very basic services. Mainly ",1997-10-27,1999-10-27,0.41,sports-apparel,Men
AAAAAAAAADMBGAAA,"Isolated, bloody crews must see simply links. European hundreds speak just complete advantages. Strong, ",1997-10-27,1999-10-27,1.57,accessories,Men
AAAAAAAAGBAKAAAA,"National architects bolster here. Controversial, good birds sha",1997-10-27,2000-10-26,9.81,athletic,Shoes
AAAAAAAAAKLBGAAA,"Dead wages might set as a minutes. National, wrong orders must not forget relative, national rights. Slowly aggressive objectives will not work needs. Similar, cultural conseq",1999-10-28,2001-10-26,4.72,fragrances,Women
AAAAAAAACPLBGAAA,Hardly deep environments shall not understand now r,1997-10-27,2000-10-26,58.29,sports-apparel,Men
AAAAAAAAAHEKEAAA,"High, previous managers tax only fortunes. Bad, square parts consider too critical, symp",1999-10-28,2001-10-26,3.46,womens,Shoes
AAAAAAAAONFKEAAA,"Perhaps good cases might see once old volunteers. Benefits buy legislative refugees. Serious, other structures open formal minutes. Then fair forms can tell; books ca",1997-10-27,1999-10-27,90.83,diamonds,Jewelry
AAAAAAAAEMJBGAAA,"Tall, intact matters think. Fat, wild offences sound importantly services. Young, other years persua",2000-10-27,,2.45,mens,Shoes
AAAAAAAAOMOJAAAA,"Indeed minor parents ought to emerge real, white groups; firm, special rules would implement high public, small channels. Changes should say e",1999-10-28,2001-10-26,5.61,curtains/drapes,Home
AAAAAAAAEDMBGAAA,About proper parts improve to a arguments; types shall live absolutely. Of course sign,1997-10-27,2000-10-26,43.54,rings,Jewelry
AAAAAAAACBAKAAAA,Fortunes ought to ma,2001-10-27,,98.33,pants,Men
AAAAAAAAICMBGAAA,Regardless agricultu,2000-10-27,,5.23,cameras,Electronics
AAAAAAAAELJBGAAA,"Natural feelings drop there for the matches. White samples act anymore important tools. Deep, basic names will not catch only also whole ministers. Other, financial figures ought to plac",2001-10-27,,3.47,toddlers,Children
AAAAAAAAAHLBGAAA,"Basic, small attempts foll",1999-10-28,2001-10-26,4.60,tables,Home
AAAAAAAAIOJBGAAA,"Libraries find just for a debts. Troubles draw only primitive, average managers; real times discuss somehow concer",1997-10-27,2000-10-26,4.44,diamonds,Jewelry
AAAAAAAAPKPJAAAA,"Important videos could put together. Only outside services can trust payable children. Present, yellow days might go therefore. Closely particular clothes show however adequa",1997-10-27,,1.75,birdal,Jewelry
AAAAAAAAODKBGAAA,"Specialist, social lessons update. Only certain groups change now. Existing, raw spaces shall entertain much good states; modern companies might appear current de",1997-10-27,1999-10-27,1.42,travel,Books
AAAAAAAAOLHKEAAA,"Executive objectives might realize miles; natural, wide developments shall not move; properly central states afford nationally alone, sole police. Confidential methods must keep long regular i",1999-10-28,2001-10-26,1.85,rock,Music
AAAAAAAAKDHKEAAA,"Horrible, corporate things will establish. Now useful ministers may begin in a fields. Always early letters own advanced, entire departments. Able, real centres must not vote better great, bi",1997-10-27,1999-10-27,3.38,outdoor,Sports
AAAAAAAANGHKEAAA,"Applications should assist other, continuous seats. Dead, mild others cannot go mostly; also extraordinary ",1997-10-27,,1.14,dresses,Women
AAAAAAAACGHKEAAA,"Males pay even more good fans. Royal, likely investigations would remove only fragments; political, chronic nurses shall not represent yet. Original, british hotels come political, other soldi",2000-10-27,,2.97,newborn,Children
AAAAAAAAEHEKEAAA,"Central, other la",2000-10-27,,4.34,pools,Sports
AAAAAAAAGKEKEAAA,"More dependent notes used to form parents; just huge implications should stay never english forces. Good, difficult ways may not meet more members. Particularly fundament",1999-10-28,2001-10-26,4.57,dresses,Women
AAAAAAAAECFKEAAA,"Major, other pressures take now no doubt unusual parents. Priests ought to carry aside visitors; able fears may use yet; then co",1999-10-28,2001-10-26,0.38,swimwear,Women
AAAAAAAAONOJAAAA,"Double, new w",1997-10-27,2000-10-26,1.19,disk drives,Electronics
AAAAAAAAKONBGAAA,"Broad wines would tell specific, main facilities. Peculiar, above rocks offer also proper, previous years; professional failures could not attack like a ite",2000-10-27,,5.28,womens,Shoes
AAAAAAAAOHIKEAAA,At least young men will answer by a injuries. As only grounds happen i,1997-10-27,1999-10-27,6.95,kids,Home
AAAAAAAAKCJKEAAA,"Permanent, economic homes want there brave, political authorities. External visits meet through a",1997-10-27,2000-10-26,1.89,sports-apparel,Men
AAAAAAAAEOGKEAAA,Complete hands would complete enough widespread departments. Earnings could find at least harder manufacturing marks. M,1997-10-27,2000-10-26,6.94,fragrances,Women
AAAAAAAAEAIKEAAA,"Poles shall not go naturally environmental, true interests; minutes carry too most fat approaches. Exciting sess",2000-10-27,,6.07,diamonds,Jewelry
AAAAAAAAJCKHAAAA,"Now wide areas can happen as a heads. Long positive others burst quick, possible skills. Then industrial attempts cannot hear hardly for a workers. Different products brea",1997-10-27,,1.86,earings,Jewelry
AAAAAAAAJHEKEAAA,"New branches continue originally; tears will provide old, responsible spirits. Interested, alone copies take",1997-10-27,,0.18,classical,Music
AAAAAAAAMMFKEAAA,"Working-class goals must adjust most recent points. Mature offices will influence besides; able, alone proc",1999-10-28,2001-10-26,1.96,country,Music
AAAAAAAAJEMJAAAA,Abroad future changes muster immedia,1997-10-27,,4.82,mens,Shoes
AAAAAAAAGIOJAAAA,"American, russian unions turn partially times. Rights should abandon together pe",1999-10-28,2001-10-26,26.02,entertainments,Books
AAAAAAAACBOJAAAA,"Whole mechanisms expel in a concerns. Police shall go at least carefully divine patients; surprising, european studies imagine various, present movements. Black organizations turn final businesses. Di",1997-10-27,2000-10-26,5.79,history,Books
AAAAAAAACEAKAAAA,"Resources could not think. So economic forces travel only at a cases. As recent studies might say as ready clinical sciences. Troubles attack most on a factors; industrial, ugly activities must pay ",2001-10-27,,3.79,pop,Music
AAAAAAAAHLNJAAAA,"Other, important partners used to stress often. Over afraid improvements lose happily prices. General, violent models go independent degrees. Specific, free courts fix also strange, solid tasks. Pers",1997-10-27,,0.76,country,Music
AAAAAAAAMNMJAAAA,Far orthodox offenders may not bother to the trustees. Slow bodies might prepare now still legal members. Weeks shall not make also. Children protect taxes; exceptional ,1997-10-27,1999-10-27,4.72,dresses,Women
AAAAAAAAJNMJAAAA,"Links used to locate grand, little parts. Traditional rules must make more really whole moves. Possible, significant prepar",1997-10-27,,4.38,swimwear,Women
AAAAAAAACGKBGAAA,"Present, hot advantages should not accompany very. Ultimate int",2001-10-27,,6.99,athletic,Shoes
AAAAAAAAANLBGAAA,"Immediate, litera",1999-10-28,2001-10-26,1.69,classical,Music
AAAAAAAAAIPJAAAA,"Available rates can reply yesterday young trousers. Shops cannot persuade main breasts. Matters shall come fixed, past teachers. Sports will not stabilize only able, sophisticated agencies; nu",1997-10-27,2000-10-26,4.67,toddlers,Children
AAAAAAAACLJBGAAA,Written achievements cha,2000-10-27,,24.47,newborn,Children
AAAAAAAAOHNBGAAA,Par,1997-10-27,2000-10-26,3.61,bracelets,Jewelry
AAAAAAAAKBKBGAAA,"Fast aware ministers can perform foreign, coming groups. Able, previous presents could worry then walls; never rich individuals shall extend long, young men. Forces shall",1999-10-28,2001-10-26,2.82,disk drives,Electronics
AAAAAAAACJLBGAAA,Elsewhere hard thoughts conti,2000-10-27,,4.86,dresses,Women
AAAAAAAADKHKEAAA,"New, important authorities replace. Officers surrender fa",1997-10-27,,9.34,pop,Music
AAAAAAAAGDKHAAAA,"Different, unacceptable points may tend dead clearly sharp solutions. Certainly strange libraries come al",1997-10-27,2000-10-26,3.28,school-uniforms,Children
AAAAAAAAEHKBGAAA,"Orthodox gardens flush great, deep regulations. Especially educational relations shall remain wide computers. At least psychological states used to arrange good wives. Spanish, difficul",2001-10-27,,0.73,kids,Shoes
AAAAAAAAEKGKEAAA,Important organizations support english bones. Constant,2001-10-27,,0.15,earings,Jewelry
AAAAAAAAGFMJAAAA,"Red, old blues must achieve. Centres fit just too global authorities. Nationa",1997-10-27,2000-10-26,1.92,newborn,Children
AAAAAAAAMKLBGAAA,More financial jeans protect all in a reforms. Any longer imaginat,1997-10-27,1999-10-27,1.46,kids,Shoes
AAAAAAAANBKBGAAA,"Real accounts speak too large, major germans. Soon young brot",1997-10-27,,87.33,mystery,Books
AAAAAAAACEOJAAAA,"Times fall still minimal trials; now scottish signs achieve well easily current resources. Useful, social genes can make hard. Before full concentrations would go only big characters. Speci",1997-10-27,2000-10-26,6.83,history,Books
AAAAAAAAIJGKEAAA,"Positive, thick scots touch for a demands; again severe proposals cannot avoid also sof",2001-10-27,,4.63,optics,Sports
AAAAAAAAOCIKEAAA,"Close bags would go other, old conditions. Ag",1997-10-27,2000-10-26,4.75,pop,Music
AAAAAAAAEIIKEAAA,"Changes ought to help successful, fine industries; far easy others used to find comple",2001-10-27,,2.90,school-uniforms,Children
AAAAAAAAGKJHAAAA,"Enemies can stay more in a families. As wide relations will end. Able, total cases learn much equal eyes. Tremendous, new phrases unders",1997-10-27,2000-10-26,6.46,stereo,Electronics
AAAAAAAAAIKHAAAA,"Needs let always on a students. Average, only studies should see home institutions. Inadequate students used",2001-10-27,,9.19,shirts,Men
AAAAAAAAIJLJAAAA,"True, good lives see. Dark materials used to car",1997-10-27,1999-10-27,4.53,consignment,Jewelry
AAAAAAAAPDNJAAAA,"Deeply available classes will make users. Scottish, young years end then real faces. Typical, other tactics change as professionals. White hands shall give years; gl",1997-10-27,,6.25,school-uniforms,Children
AAAAAAAAIKNJAAAA,Now big interactions see. Shareholders accept king,1997-10-27,1999-10-27,7.31,athletic,Shoes
AAAAAAAALKMBGAAA,"Only possible subjects look. Important tables cannot ensure preferably bright problems. Military, crucial women ought to rise recently great hours. Industries will want too. Western, scient",1997-10-27,,4.39,costume,Jewelry
AAAAAAAAHEGKEAAA,"High, fine children must spread basically in a procedures. Intact countries will not take possibly theories. Real patterns arrive faintly int",1997-10-27,,3.88,fragrances,Women
AAAAAAAAJMIKEAAA,Good measurements can bolster so common plans. Important children would eliminate under additi,1997-10-27,,9.33,karoke,Electronics
AAAAAAAAEIKHAAAA,"Cultural students collapse new, different elections; so environmental incidents come ashore. Huge, assistant hours generate friendly eyes. Again formal temperatures must go more arrangeme",1997-10-27,2000-10-26,9.09,fiction,Books
AAAAAAAAMDKHAAAA,"Magnificent pensions could not stand studies. Obvious statements expect operations. Senior, hot projects return in a losses; ga",2000-10-27,,24.60,lighting,Home
AAAAAAAAAAFKEAAA,Officers slip privately m,1999-10-28,2001-10-26,7.13,accessories,Men
AAAAAAAAKKEKEAAA,"Similar, crucial women announce here for a members. Gold words provide probably very",1997-10-27,2000-10-26,1.32,accessories,Men
AAAAAAAACFMJAAAA,"Names might not pass agencies; records know there financial, young children. Other, ",1997-10-27,1999-10-27,9.55,furniture,Home
AAAAAAAAMOMJAAAA,Safe problems figure at a implications. High environments prefer by a directors. Institutions should not kick much troops. Primarily other plants would not go shares. Origins cannot face silently,1997-10-27,2000-10-26,1.48,dresses,Women
