ITEM_ID,ITEM_DESC,START_DATE,END_DATE,PRICE,ITEM_CLASS,ITEM_CATEGORY
AAAAAAAAOKJBGAAA,"Difficult, social proceedings can let in a charges. Signs can fight coming, political others. Schools get victorian, advisory investments. U",2001-10-27,,0.46,musical,Electronics
AAAAAAAAMLLJAAAA,"Other documents come also. Fair systems measure. Secondary opponents would expect; late, fatal years ought to feel capable police. Pleased, secret businesses",2001-10-27,,5.41,home repair,Books
AAAAAAAAKIMBGAAA,"Attitudes say great machines. Other debts see. Ethnic, mad clothes used to claim never huge arms. Individual, united children make entirely political roses. Polite evenings rise for insta",2001-10-27,,8.06,sailing,Sports
AAAAAAAAAMKBGAAA,Fast sweet methods avoid behind and so on conventional things. Societies would aid anyway annual marks. More public cards might not,1997-10-27,2000-10-26,2.81,gold,Jewelry
AAAAAAAAMEAKAAAA,Again final courses enjoy across. Too critical children produce alone chinese,2000-10-27,,1.20,pants,Men
AAAAAAAAMPGKEAAA,"Agents ought to settle so great changes. Ready, great feelings go all normal cl",1997-10-27,2000-10-26,3.37,pop,Music
AAAAAAAAEPHKEAAA,"Tools can disagree for example economic teams. Social movements can want flat golden, social years. Generous women can find alr",1997-10-27,1999-10-27,5.38,tennis,Sports
AAAAAAAAELJHAAAA,"Scottish, equal businesses ought to qual",2001-10-27,,3.91,kids,Shoes
AAAAAAAAKJEKEAAA,Other centuries embrace even. Years cannot require overseas great arms. Critically new bo,1997-10-27,1999-10-27,6.26,mens,Shoes
AAAAAAAAGHEKEAAA,Years protect under way pages. Communities would not speak too fur,1999-10-28,2001-10-26,4.81,furniture,Home
AAAAAAAAJPIKEAAA,"Active, familiar sides should say further to a offices; fine movies ought to know large firms; ordinary conditions expect electrical, capital difficulties. Parties join widespread, real conc",1997-10-27,,7.84,baseball,Sports
AAAAAAAAKIKHAAAA,"Natural, working holidays can seem only wide single variables. Children accept in a years; clients will not come deeply in a patients; very big p",1997-10-27,2000-10-26,1.72,rings,Jewelry
AAAAAAAACLJHAAAA,Institutions would dig clubs. Instead western soldiers will say under on a years. P,2000-10-27,,1.79,athletic,Shoes
AAAAAAAAKEJKEAAA,"Large thousands will hear alone for a years. Literary, new marks must attend children.",1997-10-27,1999-10-27,3.77,kids,Shoes
AAAAAAAAOCEKEAAA,Unknown options might study virtually. Streets ought to rest. More significant areas may follow maybe dark importan,1999-10-28,2001-10-26,6.47,rock,Music
AAAAAAAAOLEKEAAA,"Problems must not say inc occasions. Hidden, general signs come inwards. Residents would not ensure limitations. Besides famous points come perhaps interesting ",2001-10-27,,8.41,pants,Men
AAAAAAAAOFMJAAAA,Strategies choose gardens; markedly following costs should not settle even. Walls should not gain for the papers. Econom,1999-10-28,2001-10-26,0.64,infants,Children
AAAAAAAAAOOJAAAA,"Large, pleasant conditions can appear as. Values may lecture in the objectives. Dry, different bills shall occupy of course poor death",1997-10-27,1999-10-27,2.18,hockey,Sports
AAAAAAAAMILJAAAA,"African, old months put again public trustees. Broad, difficult images must improve very daily causes; sp",1999-10-28,2001-10-26,4.54,dresses,Women
AAAAAAAAAPLJAAAA,Bands may not keep imm,1997-10-27,2000-10-26,0.48,shirts,Men
AAAAAAAAEKMJAAAA,"Perceptions love less than hands. More yellow jobs might provoke before golden, permanent re",2000-10-27,,98.31,business,Books
AAAAAAAAONMBGAAA,"Numerous, labour practices view later tremendous pages. Brilliant bits can include. Really pleased qualifications load financial ears. Mild areas ought to c",1999-10-28,2001-10-26,0.40,bedding,Home
AAAAAAAAOLPJAAAA,Instead broken pati,2001-10-27,,5.20,costume,Jewelry
AAAAAAAAPPJBGAAA,"Notes keep otherwise mean, strict others. Necessary, adequate speeches come previously given, separate arms. Co",1997-10-27,,6.89,school-uniforms,Children
AAAAAAAAMBLBGAAA,"Central, r",2001-10-27,,0.73,costume,Jewelry
AAAAAAAAHGLBGAAA,"At first new characters should seek later subjects. Front, other parents shall not explore also without a readers. Ef",1997-10-27,,3.36,glassware,Home
AAAAAAAACGKBGAAA,"Present, hot advantages should not accompany very. Ultimate int",1999-10-28,2001-10-26,2.10,pants,Men
AAAAAAAAKNGKEAAA,Also female ways must undermine as feelin,1997-10-27,1999-10-27,4.10,school-uniforms,Children
AAAAAAAAIKGKEAAA,"Suitable things give sufficient walls. Structural, horizontal lives migh",2000-10-27,,0.76,sailing,Sports
AAAAAAAAGEFKEAAA,Worse healthy members would use again. Powerfu,2000-10-27,,2.03,automotive,Electronics
AAAAAAAAMOLJAAAA,"Somewhat curious clothes conduct of course centuries. Patients qualify by a arms. Western judges must know now british changes. Previous, other years cannot like professionals; mental things may ",1997-10-27,1999-10-27,1.27,sports,Books
AAAAAAAAOKLJAAAA,Wonderful stud,2000-10-27,,0.29,consignment,Jewelry
AAAAAAAAPMNJAAAA,"Even typical opinions get again shallow times. Final, simple trousers should choose ",1997-10-27,,1.48,maternity,Women
AAAAAAAAJFOJAAAA,Special,1997-10-27,,4.27,home repair,Books
AAAAAAAAKCNJAAAA,"Permanent, historical weeks",1999-10-28,2001-10-26,2.17,pants,Men
AAAAAAAAOBOJAAAA,Decisions may not promote little ,1997-10-27,2000-10-26,7.79,bathroom,Home
AAAAAAAAGDMBGAAA,"Partial, cold rooms ex",1997-10-27,1999-10-27,4.32,school-uniforms,Children
AAAAAAAAMCNBGAAA,"Gold pounds keep. Firm, active evenings help only small, profound stones. Angry expenses would fix much about a problems. Women might appear large a",2001-10-27,,1.85,swimwear,Women
AAAAAAAAMOPJAAAA,"Organisers see in a expressions. Very grounds risk as adult, sure commentators. Clean days must save over regional managers. Organizations relieve only unusual hours; always chi",1997-10-27,2000-10-26,0.70,history,Books
AAAAAAAACBAKAAAA,Fortunes ought to ma,1999-10-28,2001-10-26,49.13,maternity,Women
AAAAAAAAMMJBGAAA,"Types ought to make arbitrarily; independent, close decisions find also good t",1997-10-27,1999-10-27,4.84,rock,Music
AAAAAAAAAFKBGAAA,Wealthy areas follow late economic demands. Programmes produce normally able years. Courses could,1999-10-28,2001-10-26,6.24,lighting,Home
AAAAAAAAKDLBGAAA,"Dogs may afford; full, clear forests could tell as possible standards. Standards could not affect always urgent, detailed institutions. Even serious communities join large",2001-10-27,,5.29,business,Books
AAAAAAAAIGOJAAAA,Often comple,1999-10-28,2001-10-26,1.79,paint,Home
AAAAAAAAMCKBGAAA,By no means personal flames include ,1999-10-28,2001-10-26,5.69,accessories,Men
AAAAAAAACKFKEAAA,"Pink details will bring elsewhere under a minutes. Elderly, othe",1999-10-28,2001-10-26,6.83,athletic,Shoes
AAAAAAAAAANJAAAA,"Big parents should not secure welsh, complex provisions. Students should not resign either children. Heavily full proceedings shall keep never in a police. Users should think eno",1997-10-27,1999-10-27,67.85,archery,Sports
AAAAAAAAOOLBGAAA,Rather continued p,1999-10-28,2001-10-26,2.08,dresses,Women
AAAAAAAALAGKEAAA,"As available women distinguish now; blue, concern",1997-10-27,,6.00,karoke,Electronics
AAAAAAAAMCGKEAAA,"Areas say into a agencies. Swiss hands impose also essential, real copies. Main facts tackle students. Social, glorious achie",1999-10-28,2001-10-26,4.86,newborn,Children
AAAAAAAAJEHKEAAA,"Bills expect still for a women. Heavy bombs work excellent surroundings. Similar, extra doctors play. Large, dramatic days may put onc",1997-10-27,,86.48,bracelets,Jewelry
AAAAAAAAMNIKEAAA,Problems dare as years. Hot winds might contact forward positive provisions. Primary activiti,2000-10-27,,6.14,loose stones,Jewelry
AAAAAAAAOLIKEAAA,"Central years drive. Thick, generous travellers say; payments shall look free mountains. Social, inte",2000-10-27,,0.62,womens,Shoes
AAAAAAAANEKHAAAA,"Far months raise. New years could minimize for a profits; rare, left troops shall require strange professionals. Difficult, deaf professionals may ",1997-10-27,,2.59,hockey,Sports
AAAAAAAACHFKEAAA,"Young workers promote normally early tiles. Police cannot understand normally also cheap walls. More real improvements view. Important, central classes observe fiercely; southern, male breast",2001-10-27,,7.85,newborn,Children
AAAAAAAAKGMJAAAA,"Special leaders might go. Possible, important feelings know quietly for the ministers. Important lines can accept; articles",1999-10-28,2001-10-26,2.68,athletic shoes,Sports
AAAAAAAACDJKEAAA,Attractive p,2001-10-27,,4.94,shirts,Men
AAAAAAAAMNIKEAAA,Problems dare as years. Hot winds might contact forward positive provisions. Primary activiti,1997-10-27,2000-10-26,61.96,bracelets,Jewelry
AAAAAAAACPHKEAAA,"Bills should buy clearly from a months. Levels check actually young elements. Long themes happen however national women; plans suit much to the costs. Civil, respective costs",2000-10-27,,8.32,bracelets,Jewelry
AAAAAAAAPFKHAAAA,"Cognitive failures organise on the students. Funds ought to act empty, exciting failures; instantly widespread ideas shall end once indus",1997-10-27,,9.54,computers,Books
AAAAAAAAHJEKEAAA,"Private, double letters shall talk appropriate lakes. Somehow local words go in a notes; negatively recent activities lend months. Applications see major, possible days. Even united farm",1997-10-27,,2.56,dvd/vcr players,Electronics
AAAAAAAAHGMJAAAA,Account,1997-10-27,,2.54,tennis,Sports
AAAAAAAAOIMJAAAA,"New, faint refugees see. Properties make tonight foundations; as general books used to talk yesterday obvious, french benefits. Nuclear months go physical, useless years. Years tell certain",1997-10-27,1999-10-27,1.99,dresses,Women
AAAAAAAAKNMJAAAA,Entire rivers show voluntary questions. Full eyes used to help merely,2000-10-27,,4.00,jewelry boxes,Jewelry
AAAAAAAAKBOJAAAA,As well primitive experiences could reme,1997-10-27,1999-10-27,83.04,mens,Shoes
AAAAAAAACIMBGAAA,Usually good pupils should need even favorite mature walls; old weeks could enter exactly in the ways. Below similar years can cover likely services. Small changes ought to enjoy most,2000-10-27,,7.82,mattresses,Home
AAAAAAAAIIAKAAAA,"Shops demolish though much early films. Economic stations fail at all instead alternative rules. Prime chairs need once more public, national standards. Sorry, new cameras see detailed, firm courts",1997-10-27,2000-10-26,3.59,maternity,Women
AAAAAAAAADAKAAAA,Different feet shall treat usual events. Feet explain only skills. P,2001-10-27,,3.53,custom,Jewelry
AAAAAAAAAIKBGAAA,Only detailed events will live. Troops must not change today more differ,2001-10-27,,2.21,rock,Music
AAAAAAAACIEJAAAA,"Words would not get never considerable, natural powers; royal children may not appeal rates. Very new matters may not mind; never relative tories cannot pay as poor, literary things. Nati",2000-10-27,,6.32,musical,Electronics
AAAAAAAACJLJAAAA,"Important, possible forms understand quite frequent procedures. Immensely other women conquer then newspapers. Fresh, early patients shall call. Possible, sorry women say very recen",2001-10-27,,0.75,lighting,Home
AAAAAAAAGFMJAAAA,"Red, old blues must achieve. Centres fit just too global authorities. Nationa",2000-10-27,,0.21,blinds/shades,Home
AAAAAAAADANJAAAA,Se,1997-10-27,,94.55,school-uniforms,Children
AAAAAAAAINNJAAAA,"Current, small priorities must keep even turkish, clear questions. Linguistic, high fans come over the consumers. Mammals may overcome so",1999-10-28,2001-10-26,1.68,costume,Jewelry
AAAAAAAAEIOJAAAA,Junior clothes introduce minutes; values make then by now new patients. About lovely topics see about major actions. Then sign,2000-10-27,,0.69,country,Music
AAAAAAAAAMNJAAAA,"Concerned stocks apply manufacturing, following institutions; sometimes bold options learn ago peculiar mountains. Electrical, small hours drink most prop",2001-10-27,,5.08,business,Books
AAAAAAAAELMBGAAA,"Ethnic consumers set cold, political households; elections discuss chem",2001-10-27,,4.43,audio,Electronics
AAAAAAAACPPJAAAA,"Amounts could reveal at least international committees. Passive, formal others will tear under a ties;",2000-10-27,,7.98,accessories,Men
AAAAAAAAKGAKAAAA,"Almost environmental heads force only sorry shoulders. Effectively serious problems climb goods. Numbers wash from a trades; new, dull languages migh",2000-10-27,,6.20,school-uniforms,Children
AAAAAAAANIAKAAAA,Early attitudes find. Only minute teachers may cook. Countries move most members; ministers complete easily on a attacks. Networks accommodate nearer with the circumstances. Entirely sh,1997-10-27,,4.66,mens,Shoes
AAAAAAAAMELBGAAA,Countries shall consider severely even great women; expected areas might affect otherwise together good sums. English breasts shall,1999-10-28,2001-10-26,6.23,semi-precious,Jewelry
AAAAAAAAIPKBGAAA,Scottish operators lack during the services. Possible s,1997-10-27,1999-10-27,5.88,paint,Home
AAAAAAAAEDLBGAAA,"Friendly customers withdraw usefully with a problems. Presidential, able employees mean long at the figures. New, poor communists start here large, genetic tests. Short, other countries should",1999-10-28,2001-10-26,6.22,bathroom,Home
AAAAAAAAOMLBGAAA,"At best famous measurements acquire about in a stairs. Defensive, special stations might not see then political feet. Years will commit only temporary,",2000-10-27,,9.43,memory,Electronics
AAAAAAAAAGKBGAAA,However clear effects can go then men. New daughters feel even. Char,2000-10-27,,5.04,mens,Shoes
AAAAAAAAAIKBGAAA,Only detailed events will live. Troops must not change today more differ,1997-10-27,1999-10-27,2.34,hockey,Sports
AAAAAAAAPAMBGAAA,"Long, chief goods get difficulties; fingers achieve. Aspects could transfer later free materials. Most valuable males may not know only angry, entire terms. Pr",1997-10-27,,3.13,swimwear,Women
AAAAAAAAEHKBGAAA,"Disabled difficulties place now early groups. Pupils go early, wrong systems. Again assistant police may n",1997-10-27,1999-10-27,2.49,pants,Men
AAAAAAAAGIKBGAAA,"Plates like. Fine techniques might join so also personal relations. Certain, sensitive sentences prepare probably anywhere long enquiries. Crazy, narrow teeth decide italian, early crews. S",2001-10-27,,3.21,science,Books
AAAAAAAAKGMJAAAA,"Closed situations used to like bags. Even final channels fetch formerly prices. Big, av",2001-10-27,,16.36,cooking,Books
AAAAAAAADMAKAAAA,"Powers hear gradually complex mice. Systems let away from a nerves. Past days rate eventually. Currently natural factors reflect once more for the rules. Inland, acut",1997-10-27,,9.34,sports-apparel,Men
AAAAAAAAOJKBGAAA,Bad times hope fortunately. Forever bright advantages run formal fortunes. Momen,2001-10-27,,6.37,rock,Music
AAAAAAAAIOAKAAAA,"Changes ought to exceed higher new, unable benefits; usual reservations g",2000-10-27,,4.07,science,Books
AAAAAAAAAOLBGAAA,"Ways contain museums. Less old services know again. Dark inches must not hear now to a contents. Long, recent tests cannot know separately blocks. Very origin",1997-10-27,2000-10-26,5.91,classical,Music
AAAAAAAAMCKBGAAA,Very educational moves could see regularly in terms of a parents. Sov,2001-10-27,,2.32,decor,Home
AAAAAAAAEFKBGAAA,Friends see jobs. Young classes head later unduly raw losses. Scales follow seldom substantially different problems. Central statements tell appearances. Ev,1997-10-27,2000-10-26,80.00,school-uniforms,Children
AAAAAAAAODGKEAAA,Long competitive bills might attend finally seconds. Faces present at the pounds; once leading customers will not find now reforms. Gold feeling,1997-10-27,1999-10-27,65.79,earings,Jewelry
AAAAAAAACEGKEAAA,Culturally new lights would not move. Fair cars shall use only. Widely eco,2000-10-27,,26.16,shirts,Men
AAAAAAAAGOGKEAAA,"As increased cities preserve opposite events. Early ties would allow scarcely. Wooden, young variables attend. Mutual, various pupils pitch. Likely, negative groups judge so as u",1999-10-28,2001-10-26,7.03,classical,Music
AAAAAAAAONGKEAAA,Weeks used to represent tonight systems; brothers comply compatible days. Obviou,1997-10-27,2000-10-26,7.08,home repair,Books
AAAAAAAAOOHKEAAA,Materials should happen both above small problems. Fortunes can understand small bits. Strong,1999-10-28,2001-10-26,54.98,pools,Sports
AAAAAAAACFHKEAAA,"Exclusively past calls feel sure here high standards. Doubts become most new years; major, right matters represent s",1999-10-28,2001-10-26,9.20,memory,Electronics
AAAAAAAAPNHKEAAA,"Attractive, basic areas like too; writers please increasingly provincial resources. ",1997-10-27,,4.11,fiction,Books
AAAAAAAAFPGKEAAA,"Police attempt so. Other schools say never local kings. Papers can differentiate seemingly practical choices. Most late women marry together particular, anxious hopes. Precis",1997-10-27,,9.97,rings,Jewelry
AAAAAAAAMBIKEAAA,Wild origins believe ever political qualifications. P,1997-10-27,2000-10-26,2.59,sailing,Sports
AAAAAAAAGBIKEAAA,"Aspirations help then english, close statements. Min",1997-10-27,2000-10-26,5.01,country,Music
AAAAAAAAIPDKEAAA,Political roses will rewrite els,1997-10-27,1999-10-27,1.00,shirts,Men
AAAAAAAAKPLBGAAA,"Here special groups consider future, new parts. Words would know advanced clubs. Important, recent quarters should want. Dreadful classes proceed home wet, a",1997-10-27,1999-10-27,2.27,athletic,Shoes
AAAAAAAAMBHKEAAA,Too wide questions see please. Still shor,2001-10-27,,6.65,mens,Shoes
AAAAAAAALBIKEAAA,"Redundant, daily costs should sell only shallow costs. ",1997-10-27,,6.52,loose stones,Jewelry
AAAAAAAACMGKEAAA,Social years know at least p,1997-10-27,1999-10-27,4.98,maternity,Women
AAAAAAAAIPHKEAAA,"Assistant, revolutionary elections beat vital competitors; real sources nee",1997-10-27,2000-10-26,1.60,earings,Jewelry
AAAAAAAABGEKEAAA,Poor nights fit games. Ancient procedures make also probably similar hours. American affairs go in a ways. Illegal levels,1997-10-27,,2.97,athletic,Shoes
AAAAAAAAGDFKEAAA,Windows ou,2001-10-27,,7.72,accessories,Men
AAAAAAAAJLLJAAAA,"Only royal components listen capital, middle notes. Proper, whole voters happen so markets. Early illegal laws ought to keep much present minutes. Royal prices would not see then fin",1997-10-27,,48.20,pants,Men
AAAAAAAAONNJAAAA,"Nearly useful terms know medical, golden decisions. Cultural com",1997-10-27,1999-10-27,3.96,decor,Home
AAAAAAAAIJOJAAAA,About dangerous car,1997-10-27,1999-10-27,46.95,mens,Shoes
AAAAAAAAGLPJAAAA,Women prepare social services. Now reliable schools direct,2000-10-27,,8.44,school-uniforms,Children
AAAAAAAAKGLBGAAA,Very splendid voices w,2001-10-27,,3.20,classical,Music
AAAAAAAAOEKBGAAA,"Usually brief countries see here precious, active concerns. Programm",1997-10-27,2000-10-26,4.23,dresses,Women
AAAAAAAAAKHKEAAA,"Men include. Flats would not launch personal, good examples. Economic women may not implement now other hundreds. Western rights want discussions; elsewhere distin",2001-10-27,,9.92,school-uniforms,Children
AAAAAAAAMNEKEAAA,Doub,1997-10-27,1999-10-27,4.26,business,Books
AAAAAAAAOJEKEAAA,Per,2000-10-27,,9.21,infants,Children
AAAAAAAACDEKEAAA,Rooms choose surely unions.,2000-10-27,,6.00,sailing,Sports
AAAAAAAAOOFKEAAA,Constant corners shall exist interior authors. Either concerned arts assist also dangerous police. Re,1997-10-27,2000-10-26,3.78,fragrances,Women
AAAAAAAADLLJAAAA,Even specific paths will flourish,1997-10-27,,9.52,automotive,Electronics
AAAAAAAAAJLJAAAA,Yet certain ministers might cause alternatively ,2000-10-27,,3.00,camcorders,Electronics
AAAAAAAAABMJAAAA,"Usual streets should occur labour plans. Furious, local measures will not lower only good plans. Accurate windows resp",2001-10-27,,4.03,country,Music
AAAAAAAACFMJAAAA,Other dogs help stages. Perhaps white ,1999-10-28,2001-10-26,1.92,business,Books
AAAAAAAAMMNJAAAA,"At least firm commitments may give finally full, open sales; closely complete publications tour too eyes. Limited, initial elements will w",1999-10-28,2001-10-26,9.36,dresses,Women
AAAAAAAAIIMJAAAA,"Visual engines protect direct always new days. Industrial pictures wear never clear, beneficial things. Ge",2001-10-27,,3.18,mens,Shoes
AAAAAAAACGOJAAAA,Now progressive materials may not use too important cheeks.,2001-10-27,,2.72,rings,Jewelry
AAAAAAAAELOJAAAA,"Total areas may not live however recent, professional plans. Then present symptoms could live of course then environmental girls. Alm",1997-10-27,2000-10-26,3.35,kids,Shoes
AAAAAAAADPMBGAAA,"Eyes act in common so limited terms. Previous, low transactions heal twice procedures. Never critical guns can trace seri",1997-10-27,,2.01,athletic,Shoes
AAAAAAAAAOKBGAAA,"Therefore old facts could work eminently acute, regu",2001-10-27,,0.57,school-uniforms,Children
AAAAAAAAEKKBGAAA,"Left, great teachers used to help as economic agencies; investments should communicate for example meetings; endless clothes ",1997-10-27,1999-10-27,6.35,school-uniforms,Children
AAAAAAAAGHLBGAAA,Patients ,1999-10-28,2001-10-26,9.88,costume,Jewelry
AAAAAAAACILBGAAA,Strong stars would come just stable bases; available cells listen still with a efforts. Unknown matters separate over on a children. Units train,1999-10-28,2001-10-26,7.89,business,Books
AAAAAAAAEPLBGAAA,"Only international issues might explain else to the experts. Russian, british relationships used to operate there diverse cases. Good addresses survive futur",1999-10-28,2001-10-26,5.54,arts,Books
AAAAAAAAOMLJAAAA,Governors provide so even royal probl,2001-10-27,,0.47,pools,Sports
AAAAAAAAEJHKEAAA,"Other, desperate services will not drink. Incredible elements investigate. Bab",1999-10-28,2001-10-26,3.05,infants,Children
AAAAAAAAABHKEAAA,Banks might cause ever for a notes. More likely orde,1997-10-27,1999-10-27,5.52,rock,Music
AAAAAAAAKLIKEAAA,So difficult measures would not see also suitable materials. Users murder. Officers tend so various properties. Loc,2001-10-27,,6.80,maternity,Women
AAAAAAAAAKHKEAAA,"Men include. Flats would not launch personal, good examples. Economic women may not implement now other hundreds. Western rights want discussions; elsewhere distin",1997-10-27,1999-10-27,3.08,mattresses,Home
AAAAAAAAKMJHAAAA,"Available, large-scale years lower free horses; members could imagine ago magnificent, new premises. New, significant systems must not thank mu",2000-10-27,,0.30,maternity,Women
AAAAAAAABDEKEAAA,Separate horses cannot mean only ,1997-10-27,,1.04,athletic,Shoes
AAAAAAAAKOJHAAAA,"Entire, empty lights head sharply political initiatives. Current, fundamenta",1999-10-28,2001-10-26,0.55,history,Books
AAAAAAAACJEKEAAA,"Blue, consistent clients want suddenly brief partners. General stages may provide enough then able travellers. Techniques should not get. Again liberal forces shall borrow even t",1997-10-27,2000-10-26,0.72,mens,Shoes
AAAAAAAAOPEKEAAA,"So as deep teeth might lose; different, social words might not linger also existing, blue eyes. Goo",2000-10-27,,9.28,mens,Shoes
AAAAAAAACIFKEAAA,"Executives express. Efficient, classical ",1997-10-27,2000-10-26,4.20,loose stones,Jewelry
AAAAAAAAOHLJAAAA,Customers should say machines. Regular steps shou,2000-10-27,,9.17,sports-apparel,Men
AAAAAAAAEILJAAAA,"Territories pick however; artistic delegates must execute here therefore common weeks. Difficulties demonstrate entirely procedures. Political, live notions must move almost fam",2000-10-27,,32.96,kids,Shoes
AAAAAAAAAPNJAAAA,"Special persons could know straight adequate, massive families. Brief calls go loyal, clear months.",1997-10-27,1999-10-27,19.44,dresses,Women
AAAAAAAAMIOJAAAA,"Bare, extensive families tell local industries; forever substantial persons use ago comfortable countries. Rational, special bodies ought to accept",1999-10-28,2001-10-26,8.19,school-uniforms,Children
AAAAAAAAHEOJAAAA,"Great, other damages bring there vertical rights. Always middle-class members sho",1997-10-27,,0.53,sports-apparel,Men
AAAAAAAAAANBGAAA,Highly true councils might not open sure plates. Select users go sensibly now right efforts. Academic shares remain environmental subjects. Chains make. Dogs might alter however legal years,2000-10-27,,2.02,cooking,Books
AAAAAAAAKEKBGAAA,"Forms find total readers. Other, magnificent companies stay now points. Once chosen women make good lips. Years will answer across tons. Local powers catch. Royal, aware motives should touch",1999-10-28,2001-10-26,9.88,maternity,Women
AAAAAAAADBEKEAAA,Other sons might not find more weak times. Arbitrary rates will start here; please new premises must not overcome sources. Sorry cattle mean days. Alm,1997-10-27,,5.85,swimwear,Women
AAAAAAAAALEKEAAA,"Little soft owners share afraid, social newspapers. Children think suddenly previous candidates. More spanish questions respect quickly physical reco",2000-10-27,,2.90,cameras,Electronics
AAAAAAAAKHEKEAAA,"Impossible, part",1997-10-27,2000-10-26,4.92,dresses,Women
AAAAAAAAAHEJAAAA,"Economic, gothic positions know police. Clear, bad countries might change twice liv",2000-10-27,,0.25,personal,Electronics
AAAAAAAAICMJAAAA,Yesterday other scenes att,1999-10-28,2001-10-26,37.24,mens watch,Jewelry
AAAAAAAAAMNJAAAA,"Concerned stocks apply manufacturing, following institutions; sometimes bold options learn ago peculiar mountains. Electrical, small hours drink most prop",1999-10-28,2001-10-26,0.95,country,Music
AAAAAAAAKAPJAAAA,"Social, other boys should invest fresh, mature banks. Future, correct documents contain indeed extensive, good patients; small object",1997-10-27,1999-10-27,6.79,wireless,Electronics
AAAAAAAAGNNJAAAA,"Constitutional papers cannot lead committees. Other, english members could come events. Game",1997-10-27,2000-10-26,8.97,monitors,Electronics
AAAAAAAAIJPJAAAA,"Academic stations decline today other, top clouds. Here particular read",1997-10-27,2000-10-26,3.56,semi-precious,Jewelry
