ITEM_ID,ITEM_DESC,START_DATE,END_DATE,PRICE,ITEM_CLASS,ITEM_CATEGORY
AAAAAAAAEAHIAAAA,Adults could exercise empty copies. Magazines u,1999-10-28,2001-10-26,3.76,womens watch,Jewelry
AAAAAAAAMCGKEAAA,Cheap parts can help totally professional devices. Available coins drop mainly. Con,1997-10-27,1999-10-27,1.52,pop,Music
AAAAAAAACAGKEAAA,Together open times see here feet. Never alive standards support cars; patients might,1997-10-27,1999-10-27,8.60,science,Books
AAAAAAAAGFGKEAAA,"Examples can take. Always cultural passengers could not go only particular international initiatives. Fixed, military times move. Absolute studies would not join vast, national",1997-10-27,1999-10-27,0.89,womens,Shoes
AAAAAAAACJGKEAAA,"Likely, corporate sons assume. Twin days ought to assume about a feet. Secure conditions want full, good rights. Individuals shall not prepare exactly however universal minutes. Nearly other le",1999-10-28,2001-10-26,3.25,musical,Electronics
AAAAAAAAABHKEAAA,Banks might cause ever for a notes. More likely orde,2001-10-27,,1.10,pants,Men
AAAAAAAABDHKEAAA,Else british streets may change to a demands. Conditions leave yet uncertain inte,1997-10-27,,1.64,flatware,Home
AAAAAAAAKKHKEAAA,Children die more yet only figures. Programmes could lear,1997-10-27,2000-10-26,4.89,automotive,Electronics
AAAAAAAACIIKEAAA,More impossible directors used to control together multiple notes. Trees stay though once very reforms. Only ears place actually. There warm elements settle rarely men. Ad,1997-10-27,2000-10-26,2.04,scanners,Electronics
AAAAAAAAEHGKEAAA,"Economic, strong results mind even much difficult bits. Successful purposes like so. Little persons used to find more so",1997-10-27,1999-10-27,1.20,school-uniforms,Children
AAAAAAAACIHKEAAA,Conceivably educational problems may sleep. Details shall,1999-10-28,2001-10-26,2.26,accent,Home
AAAAAAAAKOJHAAAA,"Entire, empty lights head sharply political initiatives. Current, fundamenta",1997-10-27,1999-10-27,6.68,sailing,Sports
AAAAAAAAECGKEAAA,Strange pupils might achieve inside a things; results escort especially in a questions; well swiss links might reconstruct afterwards on a tools. Activities score al,1997-10-27,2000-10-26,2.07,country,Music
AAAAAAAACFHKEAAA,"Beliefs face too police. Years might talk original, christian songs. Entirely old officers might avoid typically. More new problems get husbands. Measures should make today visitors. Then jun",2001-10-27,,16.90,mens,Shoes
AAAAAAAAMDGKEAAA,"Only, particular numbers could not allow now middle children. There principal costs cannot look days; common, standard obligations shall occu",1997-10-27,2000-10-26,3.50,dresses,Women
AAAAAAAAEMIKEAAA,Deputies might not differ so able ways. Simultane,1997-10-27,2000-10-26,3.68,sports,Books
AAAAAAAAKLOJAAAA,"Giant, native principles shall not lead no doubt",1997-10-27,2000-10-26,7.37,womens,Shoes
AAAAAAAAMLKBGAAA,"Patients shall not contribute attractive, new hills. More hot occupations pick as aggressive organisms. Very funny deaths should think even. Relevant things might stand",1997-10-27,1999-10-27,95.71,reference,Books
AAAAAAAAGFLBGAAA,"Then central cars cultivate once tomorrow widespread women. Long things used to balance major, slight rights. Numbers get brilliant forests. ",2000-10-27,,3.13,rock,Music
AAAAAAAAGKJHAAAA,Running hopes cannot ,2000-10-27,,6.83,sports-apparel,Men
AAAAAAAAAHEKEAAA,"High, previous managers tax only fortunes. Bad, square parts consider too critical, symp",2001-10-27,,81.69,personal,Electronics
AAAAAAAAIIFKEAAA,"Sufficient, direct generations might consult of course be",2000-10-27,,7.53,maternity,Women
AAAAAAAAKBMJAAAA,"Then english women begin by the types. Sexual sales must live centuries. Only deep services impair currently great, rig",2000-10-27,,9.94,glassware,Home
AAAAAAAAGKNJAAAA,Bitterly external varieties can remind finally. Old losses wi,1997-10-27,2000-10-26,6.38,automotive,Electronics
AAAAAAAAMHPJAAAA,Blue associations may delete very ,1997-10-27,1999-10-27,73.70,disk drives,Electronics
AAAAAAAAMJFKEAAA,"Individuals think intense discussions. Full, important grounds ",1997-10-27,1999-10-27,7.98,womens watch,Jewelry
AAAAAAAAGAOJAAAA,"Crucial, un",2000-10-27,,2.40,hockey,Sports
AAAAAAAAONNJAAAA,"Novels help more especially straightforward holders. Close, large competitors learn only in a eyes; young teeth confront new,",,2001-10-26,,athletic,Shoes
AAAAAAAAEMNJAAAA,Daughters might lead available systems. Static terms might find secondly social cases. Strongly waste years would eat only in the views; extra eyes will not lead somewhere ,2000-10-27,,5.38,country,Music
AAAAAAAAMCNBGAAA,"Gold pounds keep. Firm, active evenings help only small, profound stones. Angry expenses would fix much about a problems. Women might appear large a",1997-10-27,1999-10-27,2.08,decor,Home
AAAAAAAALMOJAAAA,"Urban fields will show less important, important modes. Countries want especially modest, ready details. Difficult conflicts should put thereby scottish bands. Marine, popular othe",1997-10-27,,0.56,athletic,Shoes
AAAAAAAAIEAKAAAA,Ideal hos,1999-10-28,2001-10-26,4.18,toddlers,Children
AAAAAAAAADKBGAAA,"Expensive, english years could not play however words. Results produce experienced, high days. Poor figures excuse girls. Front lines cooperate. Other, old authorities c",1997-10-27,2000-10-26,5.52,archery,Sports
AAAAAAAAHIAKAAAA,"Glad machines stand once to the relations. Unhappy, minor patients used to plan large things. International, emotional countries must remove explicitly. Tory, o",1997-10-27,,7.15,accessories,Men
AAAAAAAAIPKBGAAA,Scottish operators lack during the services. Possible s,1999-10-28,2001-10-26,8.87,school-uniforms,Children
AAAAAAAAJDNJAAAA,Important qualifications should let; users know never grey colleagues. Actors should not consider. For example european mo,1997-10-27,,6.54,blinds/shades,Home
AAAAAAAAGGOJAAAA,"Technological, difficult levels come only perhaps back e",2000-10-27,,5.31,karoke,Electronics
AAAAAAAAMLMJAAAA,Locally common hours locate both costs. Only safe recommendations face eventually assumptions. Also great directions snap plus a sets. Publicatio,2000-10-27,,1.44,athletic shoes,Sports
AAAAAAAAJHMJAAAA,"Points stress enough naked ideas. Full, controversial parties ought to make almost recent posts. Goods would give then low pp.; letters rush off a glasses. Instead ma",1997-10-27,,4.35,kids,Shoes
AAAAAAAACCIKEAAA,Gradual doctors would rise really large ,1997-10-27,2000-10-26,4.73,classical,Music
AAAAAAAAEAHKEAAA,Firstly marked calls place away on a supporters. Plants pay pretty women. Still good activities conce,1997-10-27,1999-10-27,4.06,shirts,Men
AAAAAAAAOHGKEAAA,"High, british accounts extend also less other men. Reasonable possibilitie",2000-10-27,,67.09,rock,Music
AAAAAAAAFNIKEAAA,"Deaf authorities will see; scottish, careful techniques present for example far new others. White, medium patterns should close also members; mi",1997-10-27,,6.18,fragrances,Women
AAAAAAAAIKKBGAAA,"Only special minutes would not think probably objects. Minute, domestic patients include more. Identical relations give. Red, encouraging cheeks would not cla",1997-10-27,2000-10-26,4.75,newborn,Children
AAAAAAAAMBEKEAAA,"Temporary themes bother as yet exciting, available houses. Chinese investors hesitate later afraid, possible circumstances. Efforts ",1997-10-27,1999-10-27,2.67,earings,Jewelry
AAAAAAAAIKFKEAAA,Rates could come only at most new ,2001-10-27,,3.20,swimwear,Women
AAAAAAAAGLLJAAAA,"General studies know there strategic, comparative sums. Necessary, new cases will finish clear pages. Records used to record gradually. Universities touch aware cases. Mon",2001-10-27,,52.84,fragrances,Women
AAAAAAAAICPJAAAA,"Right years begin american, civil divisions. Pretty trying situations will not react there good changes. Careful students might steer at a deposits. Foreign aspects used to form yet also red other",2001-10-27,,2.51,pants,Men
AAAAAAAAGILJAAAA,"Pupils will tell definitely available chemicals. Issues report recent, soviet birds. Developments could admit easier large police. Different, exciting personnel read similarly rich game",1997-10-27,1999-10-27,4.40,toddlers,Children
AAAAAAAACMKBGAAA,Marvellous factors lend there practical measures. Pro,2001-10-27,,1.55,kids,Shoes
AAAAAAAACLPJAAAA,Soon f,1999-10-28,2001-10-26,2.06,rugs,Home
AAAAAAAAINKBGAAA,"Signs stimulate tonight excellent, normal qualities. Black, forthcoming dev",1997-10-27,2000-10-26,3.12,wallpaper,Home
AAAAAAAAGLLJAAAA,"General studies know there strategic, comparative sums. Necessary, new cases will finish clear pages. Records used to record gradually. Universities touch aware cases. Mon",1999-10-28,2001-10-26,2.09,golf,Sports
AAAAAAAAAHFKEAAA,Remaining failures may prote,2000-10-27,,1.67,accessories,Men
AAAAAAAAANPJAAAA,"Senior, complete times would come public trials. Simple, assistant interests could not see fees; classical yards may direct days; internationa",1999-10-28,2001-10-26,0.94,pop,Music
AAAAAAAACLHKEAAA,"Above strong resources must want sexual, possible losses. Essentially military conditions shall not tell jus",2001-10-27,,8.31,country,Music
AAAAAAAAELIKEAAA,"Great components form also. Major, important points cope locally. Right, short ",2001-10-27,,22.36,fitness,Sports
AAAAAAAAOEIKEAAA,"Applications promote well aware, social officers. Even white players like that is increasingly necessary costs. Poor officers tak",2001-10-27,,5.76,loose stones,Jewelry
AAAAAAAAGFKHAAAA,Candidates must know hours. Particularly monetary posts return relatively identical plans. Audiences will separate; small groups used to represent actually. Other cities might not reach. Hence lar,1997-10-27,1999-10-27,3.61,fragrances,Women
AAAAAAAABJEKEAAA,"Wise decisions move seemingly poor changes. Dangerous, full communications must take. Harshly official",1997-10-27,,0.53,dresses,Women
AAAAAAAAIDGKEAAA,Here difficult words would not run rather local advanced steps. Of course old shares should use today on the changes; cases might not respond. Then pr,1999-10-28,2001-10-26,3.93,fragrances,Women
AAAAAAAAOGGKEAAA,Dogs practise ,2001-10-27,,4.45,toddlers,Children
AAAAAAAAMMIKEAAA,"Important, firm students end costs; main shares introduce in a babies. Almost social things marry almost in order normal systems. Lesser differences see then. For example genuine ",2001-10-27,,2.23,womens watch,Jewelry
AAAAAAAAMIGKEAAA,"Alone months may speak bitterly just worthwhile items. There large practices might not go available, different difficulties. Successfully delightfu",1997-10-27,1999-10-27,42.80,kids,Home
AAAAAAAAIAKHAAAA,"Green, different experiments make particular, central males. Also reasonable employers begin competitive days. American men must depart rather. Healthy, british men may pay. Fires may bring now n",1999-10-28,2001-10-26,6.03,sports,Books
AAAAAAAAOLEKEAAA,"Ideal details used to leave. National, small runs charge also immediately large forces. Successful changes might come jointly primitive, exact values. Local, british groups kill much. Clearly excelle",1997-10-27,1999-10-27,3.19,newborn,Children
AAAAAAAAOOHKEAAA,Famous talks say ministers. Perhaps old boys may not ,1997-10-27,1999-10-27,1.20,optics,Sports
AAAAAAAAAILJAAAA,"Awkward, other sections remember just immense, young police. Red fingers rise authorities; conventions ought to know wives. Eastern, royal kings sustain certainly ",1997-10-27,1999-10-27,1.47,bathroom,Home
AAAAAAAAAPLJAAAA,"Sides dust major, foreign books. Poor recommendations overcome. Walls read swiss, positive teachers. Directors come funds. Much above stages might make again. Virtually specific",2000-10-27,,2.59,shirts,Men
AAAAAAAAIGOJAAAA,Often comple,2001-10-27,,2.71,fishing,Sports
AAAAAAAACCNJAAAA,However real elections cannot please too local french places. Running details get ,2000-10-27,,1.41,televisions,Electronics
AAAAAAAACEIKEAAA,"Conditions carry no longer years. Local, continental students shall not labour at least doctors;",1999-10-28,2001-10-26,3.63,wallpaper,Home
AAAAAAAAMPJHAAAA,"Forces change. Distinct, new problems think amongst a calls. Natural, federal issues c",1999-10-28,2001-10-26,1.45,infants,Children
AAAAAAAAOAKHAAAA,"Magnetic, far waves start recently rigid, experimental minutes. Proper members carry otherwise quiet eyebrows. Standards will not explore instead professional values. ",1999-10-28,2001-10-26,2.21,toddlers,Children
AAAAAAAACGEKEAAA,Ever difficult individuals cease already. Schools refer always with a arrangements. Occupational oc,1997-10-27,2000-10-26,4.40,rock,Music
AAAAAAAAKHLJAAAA,White opponents must not come over for a houses. Women might not mean hours; thus national autho,1997-10-27,1999-10-27,73.51,athletic shoes,Sports
AAAAAAAAEKLJAAAA,"Days use still from a forces. Recently huge services must start about a details; good, just categories devel",1997-10-27,1999-10-27,1.64,toddlers,Children
AAAAAAAAAEMJAAAA,Views would study. Ago new eg,2001-10-27,,64.96,tennis,Sports
AAAAAAAAMDOJAAAA,"Competent, diverse",2000-10-27,,3.04,fishing,Sports
AAAAAAAAHBOJAAAA,"Special, annual colleagues would follow overwhelmingly less than obvious applications; apparent institutions go lectures. Powerful, human changes die always years. T",1997-10-27,,0.13,camping,Sports
AAAAAAAAGCNBGAAA,Sure low purposes might return however days. Seed,1999-10-28,2001-10-26,0.87,sports-apparel,Men
AAAAAAAAKKNBGAAA,Pale assets work best complete ways. Resources c,1997-10-27,1999-10-27,6.73,athletic,Shoes
AAAAAAAAKMPJAAAA,"Publishers say always. There silent parts used to suit also immediately natural grounds. Present scientists used to hold ideally into a mistakes. Genuine, grand ladies might liaise unknown communit",2001-10-27,,1.27,sports-apparel,Men
AAAAAAAAOLLBGAAA,"Video-taped, similar profits take today similar, white places. Sure, central schools provide far free cities. No longer british ways allow less conscious, n",1999-10-28,2001-10-26,4.27,classical,Music
AAAAAAAAAELBGAAA,"Little, limited policies take subtle, respective books. More british men keep doubtful, vast systems. Ol",1999-10-28,2001-10-26,95.25,dresses,Women
AAAAAAAAAJKBGAAA,Really acceptable dogs go then cases. Years lead as joint ,2000-10-27,,9.34,shirts,Men
AAAAAAAAOPPJAAAA,"Possible, direct questions must come boards; rar",2000-10-27,,3.12,rock,Music
AAAAAAAALBMBGAAA,"Mere advances shall become very sufficient, likely events. Useful, federal stores may not decide schools; duly original offices might run. Scottish gifts might produce lines. Especially greek me",1997-10-27,,71.55,dresses,Women
AAAAAAAAOILBGAAA,Rights will escape even mixed ,2001-10-27,,0.93,dresses,Women
AAAAAAAAMLHKEAAA,"Average, busy companies must replace indeed prizes; other factors introduce often political, new implications; ",2000-10-27,,2.39,accessories,Men
AAAAAAAAAMLJAAAA,Dry changes meet. Great judges would talk most. Di,2000-10-27,,1.24,archery,Sports
AAAAAAAAMHMJAAAA,Millions indicate easily available source,2001-10-27,,8.84,maternity,Women
AAAAAAAAPFOJAAAA,"Unfortunately functional authorities come years; subsequent accounts retain more hard policies. Empty, young officers could ",1997-10-27,,2.37,glassware,Home
AAAAAAAAMBAKAAAA,"Appropriate members come available patients. American relations used to get. Good centuries go issues. However violent terms give never civil, reasonable houses. Different, successful resources mig",1997-10-27,2000-10-26,7.05,hockey,Sports
AAAAAAAAEGPJAAAA,"Predominantly public figures mean yesterday especially hostile names. Remarkable, japanese neighbours address furthermore ea",1997-10-27,1999-10-27,0.25,estate,Jewelry
AAAAAAAANONJAAAA,"Sometimes human leads allow never during a bodies. Errors may make labour children. Various years see ever able managers. Other rates understand enough primary cells; active, central operation",1997-10-27,,5.65,maternity,Women
AAAAAAAAILHKEAAA,So as thin bi,2001-10-27,,1.10,semi-precious,Jewelry
AAAAAAAAIDJKEAAA,Pp. must discuss originally in a organisations; years ,1997-10-27,1999-10-27,6.28,tables,Home
AAAAAAAACAEKEAAA,"Fixed, satisfied books must leave reduced, fresh skills. Owners accept also old metres. Weak meetings call ago recent men. White payments choose tears; convincing, permanent assumptions ap",1997-10-27,2000-10-26,3.97,fragrances,Women
AAAAAAAAOHIKEAAA,At least head days used to turn options. Particular hands should sacrifice about just social possibilities. Studies sue above changing police; currently ,2001-10-27,,1.87,estate,Jewelry
AAAAAAAAMBHKEAAA,Too wide questions see please. Still shor,1999-10-28,2001-10-26,0.46,decor,Home
AAAAAAAAOAEKEAAA,"Usual, european leaves would leave christian, possible sizes. Thin woods talk shortly new seats. Public taxes ",2000-10-27,,0.59,costume,Jewelry
AAAAAAAAOGEKEAAA,Sources ,2000-10-27,,4.44,sports-apparel,Men
AAAAAAAAGAFKEAAA,"Events may pick only far, special developments. Broad, federal colours move warmly normally clever police. Tender, digital hours could not feel also houses. Games",1999-10-28,2001-10-26,2.90,school-uniforms,Children
AAAAAAAACHFKEAAA,Terrible roads ought to use usefull,1997-10-27,1999-10-27,7.86,home repair,Books
AAAAAAAANNLJAAAA,Always interesting men should get children. So academic pages drive following official,1997-10-27,,9.98,toddlers,Children
AAAAAAAAAHPJAAAA,"Tomorrow new stages must worry live, fun writers; suitable, entire servants shall not tell all right full, local users. Substantial struct",2001-10-27,,9.48,bracelets,Jewelry
AAAAAAAAIMOJAAAA,"Endless, compatible rates decide now members. Fit,",2001-10-27,,8.11,baseball,Sports
AAAAAAAAGFNBGAAA,"Current varieties could give never. High, t",1999-10-28,2001-10-26,0.59,televisions,Electronics
AAAAAAAAAKPJAAAA,"Other, final forces used to face. Relatively available spots attend identical patients. Thank",2001-10-27,,0.53,history,Books
AAAAAAAAGGAKAAAA,"Chemicals speak pretty available expenses. Complex shares must determine just darling, corporate shows. Good customers create again with a jo",2001-10-27,,1.03,gold,Jewelry
AAAAAAAACIAKAAAA,"Logical, successful practices describe thus gradually fair rights. As existin",2000-10-27,,21.50,kids,Shoes
AAAAAAAAMAKHAAAA,Windows ought to design too gates. Well public,2000-10-27,,0.41,baseball,Sports
AAAAAAAAANHKEAAA,"Magic, technical sections see successfully beyond a rats; there famili",1997-10-27,1999-10-27,3.12,computers,Books
AAAAAAAAIPLJAAAA,Considerations deal inevitably vast levels. Thoughtfully c,1997-10-27,1999-10-27,4.97,consignment,Jewelry
AAAAAAAAOAOJAAAA,"Right, parental users establish",2001-10-27,,8.42,optics,Sports
AAAAAAAAOCMBGAAA,"Here important months should end for the positions. Well coming resources might find totally able, political boys. Supreme speakers shall get; churc",1997-10-27,2000-10-26,4.25,school-uniforms,Children
AAAAAAAAANEKEAAA,"Yet strange years suit far clear, constant eyes; miles concentrate right books. Weeks shall ensure historical, old mechanisms. More sole actions should prescribe at least on",1997-10-27,1999-10-27,7.26,country,Music
AAAAAAAAELLJAAAA,Perhaps economic companies would tell groups; ways secure maps; essentially high lo,2000-10-27,,3.15,kids,Shoes
AAAAAAAAJBPJAAAA,Bases used to purchase away; incidentally right situations,1997-10-27,,9.54,arts,Books
AAAAAAAAEJPJAAAA,Students see quickly young parts. European others might think equally today extensive leaders. Even local questions vote very nights,1997-10-27,1999-10-27,6.78,fishing,Sports
AAAAAAAAECKBGAAA,Alone popular members prevent after a acres.,1997-10-27,2000-10-26,9.07,maternity,Women
AAAAAAAAOIPJAAAA,"Words understand much normally small points. Black things will help efforts; able, long others could cope too prices. Problems shoul",1999-10-28,2001-10-26,2.06,rock,Music
AAAAAAAALFLBGAAA,"Serious charges know military grounds. Necessary errors used to take soon true, legal friends. Mothers agre",1997-10-27,,6.23,sports-apparel,Men
AAAAAAAABHKBGAAA,"Bad, future programmes show slowly streets; small fields avoid before previous findings. Possible, financial efforts must take even christian ",1997-10-27,,8.04,fragrances,Women
AAAAAAAAEPJBGAAA,"Comfortable, other views remember happy lovers; interested teams dismiss. Old, gentle concepts would decide furthermore important, new years; necessary, worki",2000-10-27,,3.91,audio,Electronics
AAAAAAAAGDKBGAAA,As usual high areas hear quite. Fears must not promote reportedly in a ways. Natural diseases support,2000-10-27,,3.37,arts,Books
AAAAAAAAODLBGAAA,"More aware stands read most old, double studies. Difficult, deliberate units canno",2000-10-27,,3.77,toddlers,Children
AAAAAAAADHLBGAAA,"Illegal, annual reports come both precise feelings. Results see now conflicts. In particular physical mothers could contrast black, difficult years. Plants shall discuss well economic, empty ",1997-10-27,,1.45,arts,Books
AAAAAAAACAGKEAAA,Together open times see here feet. Never alive standards support cars; patients might,1999-10-28,2001-10-26,7.30,costume,Jewelry
AAAAAAAADCGKEAAA,"Thanks conquer added, small teachers. Innocently expensive hospitals would not worry national institutions; other, original cattle shall reali",1997-10-27,,1.15,mens watch,Jewelry
AAAAAAAAODGKEAAA,"Minutes try votes. Small, sexual imports might enjoy all la",2001-10-27,,3.87,womens,Shoes
AAAAAAAAIEGKEAAA,Strategies avoid selectively nations; now central machines may not write expensive minutes. Executive children evaluate more refugees. Inevitably suitable definitions help objectively co,1997-10-27,2000-10-26,1.01,kids,Shoes
AAAAAAAANHGKEAAA,"Polish, social items ought to refuse there ill pounds. Mean, new paths meet in a effects. Appropriate customers make about a years. Small others could stand longer; also original f",1997-10-27,,2.45,school-uniforms,Children
AAAAAAAAEKGKEAAA,Important organizations support english bones. Constant,1999-10-28,2001-10-26,6.68,sports-apparel,Men
AAAAAAAAALGKEAAA,"States might not afford international, federal miles. Just jud",2001-10-27,,4.16,cooking,Books
AAAAAAAAEEHKEAAA,"Careful, likely sessions used to read now dead others; girls shall introduce only other methods; substantial trends would not touch also. Comprehensive objects must not force. Re",1997-10-27,2000-10-26,3.01,athletic shoes,Sports
AAAAAAAAAEIKEAAA,"Terms may not get at least. Mental, open things shall deteriorate however charges; thorough, social years provide initiatives; relations shall get affairs; multiple, available centres bring bro",1997-10-27,2000-10-26,1.22,dresses,Women
AAAAAAAAEGHKEAAA,As well public children might n,1999-10-28,2001-10-26,0.66,pop,Music
AAAAAAAAGIHKEAAA,"Less familiar speakers could take long, vast solutions; probably formidable troops would buy; generally specific voters come again; environmental cells can retain surely broad relations. Royal, o",1997-10-27,2000-10-26,1.74,womens,Shoes
AAAAAAAACBKHAAAA,Too long,2000-10-27,,1.43,classical,Music
AAAAAAAAMMJHAAAA,"Western stages emphasise very environmental years. Private goods die as chronic tests. Huge dates shall move imaginative, theoretical others. Past studies host firms. Beautifully englis",1999-10-28,2001-10-26,8.98,fragrances,Women
AAAAAAAAMNFKEAAA,"Controversial, ready girls combine anyway; thousands give as for instan",1997-10-27,2000-10-26,0.82,golf,Sports
AAAAAAAAMJIKEAAA,"Alone, causal groups will indicate more strange, inevitable reports. Here favorite observations ought to speed especially rece",1997-10-27,1999-10-27,3.76,infants,Children
AAAAAAAAJIKHAAAA,"Able marks agree particularly for a borders. Ready, long males shall not like so hundreds; black lists overcom",1997-10-27,,2.21,accessories,Men
AAAAAAAAEBHKEAAA,"Principal, long-term experts shall see alternatively multiple markets;",2000-10-27,,1.25,shirts,Men
AAAAAAAAENGKEAAA,"British, new employers turn now great conditions. Books will pay inc techniques. As good as a",1997-10-27,1999-10-27,4.07,jewelry boxes,Jewelry
AAAAAAAAOEIKEAAA,"Applications promote well aware, social officers. Even white players like that is increasingly necessary costs. Poor officers tak",1999-10-28,2001-10-26,3.13,kids,Shoes
AAAAAAAAMKHKEAAA,Sympathetically demanding speakers must suit indeed from a bonds. Prices might lose books; freely possible enquiries will deliver years. Issues ought to find with a rocks; enor,1999-10-28,2001-10-26,1.49,shirts,Men
AAAAAAAAAKEKEAAA,Designers pay quickly inevitably odd values,2001-10-27,,5.78,stereo,Electronics
AAAAAAAAMGFKEAAA,"Grand, old times must read actually as modern rul",2001-10-27,,4.80,mens,Shoes
AAAAAAAAJCJKEAAA,Existing words ensure above the years. Simple faces may switch even public authorities. F,1997-10-27,,9.01,camping,Sports
AAAAAAAAOJHKEAAA,"Necessary, ",1997-10-27,2000-10-26,99.43,maternity,Women
AAAAAAAAGFEKEAAA,"Anyhow amazing parties suffer well ordinary, close efforts; indeed ",2000-10-27,,4.14,semi-precious,Jewelry
AAAAAAAAAKEKEAAA,Relative situations can win together reasonable holders; under good goals co,1997-10-27,1999-10-27,4.61,home repair,Books
AAAAAAAAIOFKEAAA,Different leaders might not check through a women. Children ought to place both economic arrangements. S,2000-10-27,,3.06,classical,Music
AAAAAAAAACMJAAAA,"Orange, overall poli",1997-10-27,2000-10-26,8.09,infants,Children
AAAAAAAAMPLJAAAA,"New, poor teachers pa",2000-10-27,,1.67,athletic,Shoes
AAAAAAAACJPJAAAA,Sentences c,2000-10-27,,7.47,newborn,Children
AAAAAAAAMMAKAAAA,As excellent areas could dream normally new new women; poor responsibilities,1999-10-28,2001-10-26,0.87,bathroom,Home
AAAAAAAAGGIKEAAA,"Also strong ways validate major, professional ho",1997-10-27,1999-10-27,2.94,sports-apparel,Men
AAAAAAAAEPFKEAAA,"Resources shall upset sure social, alternative lakes. Otherwise busy needs shall seem ago skills. Simply small opportunities appreciate speedily american, imme",1997-10-27,2000-10-26,1.14,archery,Sports
